Gordon E. Tower,Y,"Belding, Michigan","Belding High School, Belding, MI",-85.2272,43.0992,pre-1901,Prepared at Belding (Mich.) High School,"Michigan Agricultural College, East Lansing, MI",-84.4836,42.7246,1901,Graduated with B.S. degree,United States Forest Service (field),-77.0369,38.9072,1901-1903,Served in Forest Service from July 1901 until entering Yale Forest School,,,,,,,,,,,,,,,,Yale (Student),-72.9279,41.3083,undefined,Student at Yale,"Yale Forest School, Milford, PA",-74.7996,41.3223,1905,"Assistant at Yale Forest School at Milford, PA (summer 1905)","University of Maine, Orono, ME",-68.6668,44.8985,1905-1910,Professor of forestry at University of Maine,"Waldo Hills Orchard Company, Salem, OR",-123.0351,44.9429,1910-present,"Horticulturist for Waldo Hills Orchard Company, Salem, OR",,,,,,,,,,,,,,,,,,,,,,,,,,,,,,,1905
Lage Wernstedt,Y,"Strengnäs, Sweden","Gymnasium, Norrköping, Sweden",16.1826,58.5877,pre-1902,"Prepared at Gymnasium, Norrköping, Sweden","Royal Institute of Technology, Stockholm, Sweden",18.0686,59.3293,1902,Received M.E. degree,Draftsman (1 year),18.0686,59.3293,1902-1903,Spent one year as a draftsman before entering Yale,,,,,,,,,,,,,,,,Yale (Student),-72.9279,41.3083,undefined,Student at Yale,"Forest Service – AZ, CA, OR, NV, WA, ID, AK",-122.6784,45.5051,1905-present,"Forest expert and assistant; boundary work and reconnaissance in AZ, CA, OR, NV, WA, ID, AK; also Priest River, Chugach and Columbia NFs; topographic maps and surveys; HQ Portland OR",,,,,,,,,,,,,,,,,,,,,,,,,,,,,,,,,,,,,,,,,1905
Trueman D. Woodbury,Y,"Bluehill, Maine","Saxtons River Academy, Saxtons River, VT",-72.5165,43.1334,pre-1903,Prepared at Saxtons River Academy,"Brown University, Providence, RI",-71.4025,41.8268,1903,Received Ph.B. degree; member Phi Beta Kappa,,,,,,,,,,,,,,,,,,,,,Yale (Student),-72.9279,41.3083,undefined,Student at Yale,United States Forest Service,-77.0369,38.9072,1905-1907,Forest assistant (two years),United States Forest Service,-77.0369,38.9072,1907-1909,Inspector (two years),"Forest Service District 5, San Francisco, CA",-122.4194,37.7749,1909-present,"Assistant district forester; headquarters San Francisco, CA",,,,,,,,,,,,,,,,,,,,,,,,,,,,,,,1905
Karl W. Woodward,Y,"Detroit, Michigan","Montclair High School, Montclair, NJ",-74.209,40.8259,pre-1904,Prepared at Montclair High School,"Cornell University, Ithaca, NY",-76.4735,42.4534,1904,Received B.A. degree at Cornell,,,,,,,,,,,,,,,,,,,,,Yale (Student),-72.9279,41.3083,undefined,Student at Yale,United States Forest Service,-77.0369,38.9072,1905-present,Forest assistant; assistant forest inspector; charge of Northern Pacific Estimates project; adviser to Dominican government; now in charge of examination/acquisition of lands under Weeks Law,,,,,,,,,,,,,,,,,,,,,,,,,,,,,,,,,,,,,,,,,1905
Theodore C. Zschokke,Y,"Wapello, Iowa","Palo Alto High School, Palo Alto, CA",-122.143,37.4419,pre-1903,Prepared at Palo Alto High School,"Leland Stanford Jr. University, Palo Alto, CA",-122.1697,37.4275,1903,Graduated with B.A. degree,Philippines (military service),121.774,12.8797,1898-1901,"Enlisted Company K, 1st CA Infantry (1898-99); then Company L, 36th Infantry (1899-1901); campaigns in Philippines",,,,,,,,,,,,,,,,Yale (Student),-72.9279,41.3083,undefined,Student at Yale,"Bureau of Forestry, Manila, Philippines",120.9842,14.5995,1905-1910,"Forester of Bureau of Forestry, Manila PI (Sept 1, 1905 – Sept 14, 1910)","Pacific Grading Company, San Francisco, CA",-122.4194,37.7749,1912-present,Partner in contracts of Pacific Grading Company of San Francisco; foreman in charge of operations,,,,,,,,,,,,,,,,,,,,,,,,,,,,,,,,,,,,1905
Harry M. Hale,Certificate (not degree),"Elbridge, New York","Munro Collegiate Institute, Elbridge, NY",-76.4493,43.1537,pre-Yale,Prepared at Munro Collegiate Institute,"Cornell Forestry School, Ithaca, NY",-76.4735,42.4534,pre-1905,Studied two years in Cornell Forestry School before entering Yale,,,,,,,,,,,,,,,,,,,,,Yale (Student),-72.9279,41.3083,undefined,Student at Yale,United States Forest Service,-77.0369,38.9072,post-1905,"Government Service: forest expert, assistant, deputy supervisor","Okanogan National Forest, Okanogan, WA",-119.5732,48.3612,present,"Supervisor of Okanogan Forest, District 6; headquarters at Okanogan, WA",,,,,,,,,,,,,,,,,,,,,,,,,,,,,,,,,,,,1905
John S. Holmes,Certificate (not degree),"Coburg, Ontario, Canada",Public schools of North Wales,-3.7837,52.7966,early,Prepared at public schools of North Wales,"Private school, North Carolina",-79,35.5,pre-1888,Private school in North Carolina,"University of North Carolina, Chapel Hill, NC",-79.052,35.9049,pre-1888,"Attended UNC, two-year course in agriculture, leaving 1888","Henderson County, NC (farming)",-82.464,35.3229,1888-1902,"Farmed in Henderson County, NC",US Forest Service (student assistant),-77.0369,38.9072,1902-1905,Entered US Forest Service as student assistant in November 1902,,,,,,Yale (Student),-72.9279,41.3083,undefined,Student at Yale,South Appalachians (Forest Service),-83,35.5,1905,Commercial tree studies in South Appalachians,Forest Service District 3,-106.6504,35.0844,1906,Timber sale inspection in District 3,Kentucky (forest conditions study),-84.27,37.8393,1907,Study of forest conditions of Kentucky,"NC Geological and Economic Survey, Chapel Hill, NC",-79.052,35.9049,1909-present,Forester for North Carolina Geological and Economic Survey (appointed June 1909),,,,,,,,,,,,,,,,,,,,,,,,,,1905
Stanton G. Smith,Certificate (not degree),"Berkley, Maryland","Westtown Boarding School, Westtown, PA",-75.5501,39.944,pre-Yale,Prepared at Westtown Boarding School,"Cornell University, Ithaca, NY",-76.4735,42.4534,pre-1905,Attended Cornell University for a time before entering Yale,,,,,,,,,,,,,,,,,,,,,Yale (Student),-72.9279,41.3083,undefined,Student at Yale,United States Forest Service,-77.0369,38.9072,1906-1909,Forest assistant; chief of section of boundaries; forest examiner,"Forest Service District 3, Albuquerque, NM",-106.6504,35.0844,1909-1913,"Forest supervisor (appointed Oct 1909); located in Albuquerque, NM","Snoqualmie National Forest, Seattle, WA",-122.3321,47.6062,1913-present,"Supervisor Snoqualmie NF, District 6; stationed in Seattle, WA",,,,,,,,,,,,,,,,,,,,,,,,,,,,,,,1905
James M. Fetherolf,N,"Kempton, Pennsylvania","Common schools / Lynnville Academy, PA",-75.6,40.5,pre-1901,Common schools; prepared for college at Lynnville Academy,"Muhlenberg College, Allentown, PA",-75.4766,40.6084,1901,Graduated with B.A. degree,Bureau of Forestry (student assistant),-77.0369,38.9072,pre-1905,Worked for Bureau of Forestry as student assistant before Yale,,,,,,,,,,,,,,,,Yale (Student),-72.9279,41.3083,undefined,Student at Yale,Dakotas and Western Minnesota (Forest Service),-99,44.5,1904,Forest assistant; extensive study of planted groves in two Dakotas and Western Minnesota,United States Forest Service,-77.0369,38.9072,1904-1906,Forest assistant,"Wasatch Forest, UT",-111.591,40.7608,1906,Planting reconnaissance of Wasatch Forest,"Salt Lake / Wasatch Nursery, UT",-111.891,40.7608,1907-1908,Established Wasatch Nursery (spring 1907); general inspector District 4 (summer 1908),"Forest Service District 4, Ogden, UT",-111.9738,41.223,1908-present,"In charge of reforestation work in District 4; headquarters Ogden, UT",,,,,,,,,,,,,,,,,,,,,1905
David G. Kinney,N,"Utica, New York","Utica Free Academy, Utica, NY",-75.2327,43.1009,pre-1898,Prepared at Utica Free Academy,"St. Paul's School, Concord, NH",-71.5724,43.2081,1898,Prepared at St. Paul's School; graduated 1898,"Harvard University, Cambridge, MA",-71.1167,42.3736,1899-1901,Entered Harvard 1899; left 1901,Government forestry work (field),-77.0369,38.9072,1901-1904,Began forestry work with government July 1901; passed civil service exams 1904,,,,,,,,,,,Yale (Student),-72.9279,41.3083,undefined,Student at Yale,Forest Service (forest products division),-77.0369,38.9072,post-Yale,One year in forest products division of Forest Service,"Flathead/Missoula/Glacier NP area, MT",-114.3597,48.196,1905-1907,"Technical assistant on Flathead, Missoula and Glacier NP forests (July 1 1905 – March 14 1907)","Kootenai, Cabinet, and Missoula NFs, MT",-115.5548,48.2766,1907-1912,"Forest supervisor at Kootenai, Cabinet (N) and Missoula National Forests","Cincinnati, OH (furlough)",-84.512,39.1031,1912,"On furlough from duty; living in Cincinnati, OH","Cleveland National Forest, San Diego, CA",-116.7719,33.0853,1913-present,"Supervisor of Cleveland National Forest (appointed March 1, 1913)",,,,,,,,,,,,,,,,,,,,,1905
Harold D. Langille,N,"Tusket, Nova Scotia, Canada",Oregon (country school),-120.5542,43.8041,1883-1900,Moved to Oregon in 1883; educated in country school; grew up interested in trees and botany,US Geological Survey / Bureau of Forestry / Interior Dept (field),-77.0369,38.9072,1900-1905,Engaged by USGS 1900; transferred to Bureau of Forestry; then Interior Dept as forest inspector on forest reserves,,,,,,,,,,,,,,,,,,,,,Yale (Student),-72.9279,41.3083,undefined,Student at Yale,United States Forest Service,-77.0369,38.9072,pre-1905,Forest inspector until August 1905,Oregon (real estate and timber),-120.5542,43.8041,1905-1906,Real estate and timber business,"James D. Lacey & Company, Portland, OR",-122.6784,45.5051,1906-present,"Western manager of Portland office of James D. Lacey & Company, timber land factors",,,,,,,,,,,,,,,,,,,,,,,,,,,,,,,1905
Chester A. Mathewson,N,"Cincinnati, Ohio","University of Cincinnati, Cincinnati, OH",-84.512,39.1031,pre-Yale,Attended University of Cincinnati before entering Yale; also taught in secondary schools,,,,,,,,,,,,,,,,,,,,,,,,,,Yale (Student),-72.9279,41.3083,undefined,Student at Yale,"Columbia University, New York City, NY",-73.9632,40.8076,1905-1906,"Instructor, Columbia University; received B.S. 1905, M.A. 1906","Plainfield, NJ (teaching)",-74.4074,40.6337,1906-1907,"Teacher in Plainfield, NJ","High School of Commerce, New York City, NY",-74.006,40.7128,1907-1910,"Teacher of biology, High School of Commerce, NYC","Training School for Teachers, Brooklyn, NY",-73.9496,40.6501,1910-present,"Professor of biology at Training School for Teachers, Brooklyn; received Ph.D. Columbia 1912",,,,,,,,,,,,,,,,,,,,,,,,,,1905
Ernest A. Sanders,N,,"Ohio State University, Columbus, OH",-83.0458,39.9612,1903,Received M.A. degree at Ohio State University,,,,,,,,,,,,,,,,,,,,,,,,,,Yale (Student),-72.9279,41.3083,undefined,Student at Yale,"Westerville, OH",-82.929,40.1262,present,Registered at Forest School during part of Junior year; no further information provided,,,,,,,,,,,,,,,,,,,,,,,,,,,,,,,,,,,,,,,,,1905
Herbert O. Stabler,N,"Sandy Spring, Maryland","George School, Newtown, PA",-74.9488,40.2293,pre-Yale,Prepared at George School in Pennsylvania,"Cornell Forestry School, Ithaca, NY",-76.4735,42.4534,pre-1905,Attended Cornell Forestry School for the year previous to its discontinuance,,,,,,,,,,,,,,,,,,,,,Yale (Student),-72.9279,41.3083,undefined,Student at Yale,United States Forest Service (boundary work),-77.0369,38.9072,1905-1907,Forest assistant on boundary work,United States Forest Service,-77.0369,38.9072,1907-1908,"Assistant chief of boundaries (July 29 – Nov 30, 1907); chief of boundaries (Dec 1, 1907 – Apr 30, 1908); assistant chief, office of lands (May 1 – Oct 31, 1908)","Columbia National Forest, Portland, OR (HQ)",-122.6784,45.5051,1908-present,"Forest supervisor, Columbia National Forest, Washington; headquarters in Portland, OR",,,,,,,,,,,,,,,,,,,,,,,,,,,,,,,1905
Gardiner Watkins,N,,"Princeton University, Princeton, NJ",-74.6514,40.3573,1903,Graduated with B.A. at Princeton University,,,,,,,,,,,,,,,,,,,,,,,,,,Yale (Student),-72.9279,41.3083,undefined,Student at Yale,"New York City, NY",-74.006,40.7128,present,Registered at Yale Forest School during Junior year; no further information provided,,,,,,,,,,,,,,,,,,,,,,,,,,,,,,,,,,,,,,,,,1905
Arnot W. Whetstone,N,,"Ohio State University, Columbus, OH",-83.0458,39.9612,1903,Received M.A. degree at Ohio State University,,,,,,,,,,,,,,,,,,,,,,,,,,Yale (Student),-72.9279,41.3083,undefined,Student at Yale,"Van Buren, OH",-83.6374,40.8698,present,Registered at Forest School during part of Junior year; no further information provided,,,,,,,,,,,,,,,,,,,,,,,,,,,,,,,,,,,,,,,,,1905
Edmund J. Zavitz,N,"Ridgeway, Ontario, Canada","Woodstock College, Woodstock, ON, Canada",-80.7573,43.1307,pre-1903,Attended Woodstock College,"McMaster University, Toronto, ON, Canada",-79.3832,43.6532,1903,Received B.A. from McMaster University,,,,,,,,,,,,,,,,,,,,,Yale (Student),-72.9279,41.3083,undefined,Student at Yale,"Ontario Agricultural College / Dept of Agriculture, Guelph, ON, Canada",-80.2274,43.5501,1905-present,Forester at Ontario Agricultural College and Department of Agriculture of Ontario,,,,,,,,,,,,,,,,,,,,,,,,,,,,,,,,,,,,,,,,,1905
J. Howard Allison,Y,"East Granby, Connecticut","District Schools, East Granby and Granby, CT",-72.829,41.9612,pre-1905,Prepared at district schools in East Granby and Granby,"Hartford High School, Hartford, CT",-72.6851,41.7637,pre-1905,Prepared at Hartford High School,"Sheffield Scientific School, Yale, New Haven, CT",-72.9223,41.3111,1905,Graduated from Sheffield Scientific School at Yale,,,,,,,,,,,,,,,,Yale (Student),-72.9279,41.3083,undefined,Student at Yale,"Coconino National Forest, AZ",-111.7532,35.2048,1906-1909,Forest assistant; general administration work on Coconino NF until Apr 1908; then in charge of Coconino NF reconnaissance party until Jan 1909,"Forest Service District 3, Albuquerque, NM",-106.6504,35.0844,1909-1912,Inspecting reconnaissance work or in charge of field parties; prepared Coconino Working Plan; in charge of reconnaissance and Geography office,"College of Forestry, University Farm, St. Paul, MN",-93.1773,44.9924,1913-present,"Resigned from Service Jan 1913 to take up teaching at College of Forestry, St. Paul",,,,,,,,,,,,,,,,,,,,,,,,,,,,,,,1906
Fred E. Ames,Y,"Spencer, Massachusetts","David Prouty High School, Spencer, MA",-71.9923,42.2459,pre-1899,Prepared at David Prouty High School,"Lawrence Scientific School, Harvard, Cambridge, MA",-71.1167,42.3736,1899-1900,"Attended Lawrence Scientific School, Harvard","Harvard University, Cambridge, MA",-71.1167,42.3736,1903,Received B.A. at Harvard; member of Delta Upsilon,"Banking house, Boston, MA",-71.0589,42.3601,1903-1904,Employed in a banking house in Boston,,,,,,,,,,,Yale (Student),-72.9279,41.3083,undefined,Student at Yale,"Washington, DC (Forest Service)",-77.0369,38.9072,1906-1907,Forest assistant at Washington DC headquarters; assigned to Santa Catalina NF AZ (timber sale report),"Forest Service District 6, Portland, OR",-122.6784,45.5051,1907-1908,"Assistant inspector, northwest district under Inspector E.T. Allen; general inspection of forests in OR and WA","Washington, DC (Forest Service)",-77.0369,38.9072,1908,Called to Washington for office assignment during Forest Service reorganization,"Forest Service District 6, Portland, OR",-122.6784,45.5051,1908-present,"Chief of silviculture Dec 1908; assistant district forester Jan 1910; in charge of office of silviculture, District 6 (OR, WA, AK)",,,,,,,,,,,,,,,,,,,,,,,,,,1906
Martin L. Erickson,Y,"Saint Olaf, Iowa","High School, Flandreau, SD",-96.5975,44.0025,pre-1901,"Prepared at high school in Flandreau, SD","South Dakota State Agricultural College, Brookings, SD",-96.7985,44.3167,1901,Attended South Dakota State Agricultural College,"University of Minnesota, Minneapolis, MN",-93.2277,44.974,1903,"Graduated from Agricultural Dept, University of Minnesota; worked for lumber companies during vacations",,,,,,,,,,,,,,,,Yale (Student),-72.9279,41.3083,undefined,Student at Yale,United States Forest Service,-77.0369,38.9072,1906-1908,Forest Service upon graduation,"Crater National Forest, Medford, OR",-122.8756,42.3265,1908-present,"Supervisor of Crater National Forest; headquarters Medford, OR (since Dec 1, 1908)",,,,,,,,,,,,,,,,,,,,,,,,,,,,,,,,,,,,1906
Dennis C. A. Galarneau,Y,"Holyoke, Massachusetts","Holyoke High School, Holyoke, MA",-72.6162,42.2042,pre-1904,Prepared at Holyoke (Mass.) High School,"Tufts College, Medford, MA",-71.119,42.4075,1904,Received B.A. from Tufts College; member Theta Delta Chi,,,,,,,,,,,,,,,,,,,,,Yale (Student),-72.9279,41.3083,undefined,Student at Yale,United States Forest Service,-77.0369,38.9072,1906-1910,"Forest assistant, United States Forest Service","John Fenderson & Company, Sayabec, Quebec, Canada",-67.6918,48.5632,1910-1911,Forester for John Fenderson & Company,"Hampden Lumber Company, Springfield, MA",-72.5898,42.1015,1911,Employment with Hampden Lumber Company (Feb-Jul 1911),"Clark & Lyford, Vancouver, BC, Canada",-123.1207,49.2827,1911,"Cruiser for Clark & Lyford, forest engineers of Vancouver BC (Jul-Oct 1911)","Lyford, Clark & Lyford, Montreal, QC, Canada",-73.5674,45.5017,1911-1912,"Cruiser for Lyford, Clark & Lyford of Montreal (Oct 1911 – Nov 1912)","Canadian Pacific Railway, Montreal, QC, Canada",-73.5674,45.5017,1912-present,"Assistant forester, Dept of Natural Resources, Canadian Pacific Railway (since Nov 1912)",,,,,,,,,,,,,,,,1906
John D. Guthrie,Y,"Charlotte Courthouse, Virginia","Charlotte High School, Charlotte, VA",-78.642,37.0285,pre-1902,Prepared at Charlotte (VA) High School,"Union College, Schenectady, NY",-73.926,42.8195,1902,"Received Ph.B. from Union College; member Sigma Phi, editor of college weekly and annual","United States Forest Service (student, multiple states)",-87,36,1902-1904,"Employed in US Forest Service 1902-1904: TN, ME, TX, NM, CA, UT",,,,,,,,,,,,,,,,Yale (Student),-72.9279,41.3083,undefined,Student at Yale,United States Forest Service (multi-state),-110,34,1902-1908,"Student assistant, asst forest expert, forest agent, forest assistant; worked in TN, ME, TX, NM, CA, ID, OR, UT, AZ, NH","Apache National Forest, Springerville, AZ",-109.2862,34.1337,1906-present,Forest assistant 1906-1908; deputy forest supervisor 1908; supervisor of Apache NF (same year),,,,,,,,,,,,,,,,,,,,,,,,,,,,,,,,,,,,1906
"James A. Howarth, Jr.",Y,"New Haven, Connecticut","New Haven High School, New Haven, CT",-72.9223,41.3111,pre-1893,Prepared at New Haven High School,"Sheffield Scientific School, Yale, New Haven, CT",-72.9223,41.3111,1893-1894,Attended Sheffield Scientific School at Yale 1893-94,"Yale Law School, New Haven, CT",-72.9223,41.3111,1896,Received LL.B. cum laude from Yale Law School,"Law Practice, New Haven, CT (Case, Ely & Webb and Ullman)",-72.9223,41.3111,pre-1906,Practiced law in two New Haven offices; also tried business in NY and elsewhere,,,,,,,,,,,Yale (Student),-72.9279,41.3083,undefined,Student at Yale,"Indian Reservations, Wisconsin and Minnesota (Forest Service)",-90,46,1906-1909,Forest assistant in US Forest Service; assigned to Indian reservations in WI and MN,"Superior National Forest, Minnesota",-91.864,47.823,1909-1910,"Forest assistant in Superior National Forest, MN (Dec 1909 – Jul 1910)","Duluth, MN (real estate)",-92.1005,46.7867,1910-1911,Year's leave of absence; selling Duluth real estate,"Fond du Lac Reservation, Minnesota (Indian Service)",-92.7527,46.7058,post-1911,Transferred to Indian Service; forest assistant at Fond du Lac Reservation MN,"Cloquet, MN (Indian Service)",-92.4658,46.7219,present,Superintendent in the Indian Service at Cloquet,,,,,,,,,,,,,,,,,,,,,1906
Frederick W. H. Jacombe,Y,"Guelph, Ontario, Canada","Guelph High School, Guelph, ON, Canada",-80.2274,43.5501,pre-1896,Prepared at Guelph (Ont.) High School,"University of Toronto, Toronto, ON, Canada",-79.3832,43.6532,1896-1898,Received B.A. (1896) and M.A. (1898),,,,,,,,,,,,,,,,,,,,,Yale (Student),-72.9279,41.3083,undefined,Student at Yale,"Forestry Branch, Dept of the Interior, Ottawa, ON, Canada",-75.6972,45.4215,1906-present,"Forestry Branch of the Department of the Interior, Ottawa; secretary/treasurer Canadian Society of Forest Engineers 1908-12; asst secretary Canadian Forestry Assn",,,,,,,,,,,,,,,,,,,,,,,,,,,,,,,,,,,,,,,,,1906
Sydney L. Moore,Y,"St. Louis, Missouri","Public Schools, St. Louis, MO",-90.1994,38.627,pre-1904,"Prepared at public schools in St. Louis, MO","Princeton University, Princeton, NJ",-74.6514,40.3573,1904,Received B.A. from Princeton; member Phi Beta Kappa and Princeton Campus Club,,,,,,,,,,,,,,,,,,,,,Yale (Student),-72.9279,41.3083,undefined,Student at Yale,"Sawtooth National Forest, ID",-114.9,44,1906-1907,"Forest assistant; assigned to Sawtooth NF; general forest administration, especially timber sales","Lewis and Clark National Forest, MT",-110.6,47,1907-1908,Timber reconnaissance in cooperation with Northern Pacific Railroad Company,"Forest Service District 2, Denver, CO",-104.9903,39.7392,1908-1909,Forest inspector HQ Denver (Feb 1908); assistant chief of silviculture District 2 (Dec 1908),"Forest Service District 2, Denver, CO",-104.9903,39.7392,1909-1913,Assistant district forester in charge of silviculture at Denver,"R.R. Sizer & Company, New York City, NY",-74.006,40.7128,1913-present,"Resigned Forest Service Mar 1, 1913; entered employ of R.R. Sizer & Company, timber brokers, NYC",,,,,,,,,,,,,,,,,,,,,1906
Andrew E. Oman,Y,"Leonardville, Kansas","Kansas State Agricultural College, Manhattan, KS",-96.5867,39.1836,1900,Graduated with B.S.; served as cadet; taught three winters in public schools after graduation,,,,,,,,,,,,,,,,,,,,,,,,,,Yale (Student),-72.9279,41.3083,undefined,Student at Yale,"Washington, DC (Forest Service, office of forest extension)",-77.0369,38.9072,1906-1909,Forest assistant; worked in office of forest extension in Washington DC,"Utah Agricultural College, Logan, UT",-111.8338,41.737,1912,Taught 10-week ranger's short course in forestry at Utah Agricultural College (Jan-Mar 1912),"Weiser National Forest, ID",-116.9669,44.2518,1909-present,Forest assistant with promotion; headquarters Weiser National Forest ID since Jul 1909,,,,,,,,,,,,,,,,,,,,,,,,,,,,,,,1906
Arthur D. Read,Y,"near Quincy, Illinois","Public Schools, Emporia, KS",-96.1817,38.404,pre-1903,"Prepared at public schools in Emporia, KS","College of Emporia, Emporia, KS",-96.1817,38.404,1903,Received B.A. from College of Emporia,,,,,,,,,,,,,,,,,,,,,Yale (Student),-72.9279,41.3083,undefined,Student at Yale,United States Forest Service,-77.0369,38.9072,1906-1908,Forest assistant in the Service,United States Forest Service,-77.0369,38.9072,1908-1910,Forest supervisor,United States Forest Service,-77.0369,38.9072,1910-1911,Deputy supervisor,Forest Service District 3 / Washington DC,-106.6504,35.0844,1911-present,Forest examiner; grazing reconnaissance 1912; district HQ Albuquerque NM; now in Washington DC office,,,,,,,,,,,,,,,,,,,,,,,,,,1906
Arthur B. Recknagel,Y,"Brooklyn, New York","Bedford Military Academy, Great Neck, NY",-73.7273,40.789,pre-1904,Prepared at Bedford Military Academy,"Adelphi Academy, Brooklyn, NY",-73.9496,40.6501,pre-1904,"Prepared at Adelphi Academy, Brooklyn","Yale College, New Haven, CT",-72.9223,41.3111,1904,"Graduated from Yale College; member Sigma Xi, recipient Scott Prize in German",,,,,,,,,,,,,,,,Yale (Student),-72.9279,41.3083,undefined,Student at Yale,"Santa Fe NM (Jemez, Carson, Pecos NFs)",-105.9378,35.687,1906,"Forest assistant; timber sale examinations on Jemez, Carson and Pecos NFs","Beaver National Forest, UT",-112,38.5,1906,Transferred to Beaver NF for similar timber sale work (Nov 1906),"Coconino National Forest, Flagstaff, AZ",-111.6513,35.1983,1906-1907,"Growth studies (western yellow pine), marking and estimates until Jun 1907","Washington, DC (Forest Service)",-77.0369,38.9072,1907-1908,Timber sale detail; GA and TN congressional tours; acting/confirmed chief of section of reconnaissance,"Multi-state field trip (NM, CO, UT, WY, MT, ID, WA) then Washington DC",-106,39,1908,Four-month trip organizing new field work; then back to DC; Alabama congressional tours,"Forest Service District 3, Albuquerque, NM",-106.6504,35.0844,1908-1911,"Assistant chief of silviculture, District 3 (nearly three years until Oct 1911)","Europe (Forest Akademie Eberswalde/Tharandt, Germany; France; Switzerland; Austria)",13.8147,52.8267,1911-1912,Year's leave to study forest conditions abroad; enrolled Forstakademie Eberswalde; settled at Dresden; specialized in working plan practice,"Cornell University, Ithaca, NY",-76.4735,42.4534,1913-present,"Professor of forestry, NY State College of Agriculture at Cornell (since Feb 1, 1913); teaches forest management, utilization, wood technology",,,,,,1906
Alexander H. D. Ross,Y,"Carlton Place, Ontario, Canada","Carlton Place High School, Carlton Place, ON, Canada",-76.1478,45.1393,pre-1888,Prepared at Carlton Place High School,"Kingston Collegiate Institute, Kingston, ON, Canada",-76.488,44.2298,pre-1888,Prepared at Kingston Collegiate Institute,"Queen's University, Kingston, ON, Canada",-76.488,44.2298,1888-1889,Received B.A. (1888) and M.A. (1889),Ontario High Schools and Collegiate Institute (teaching),-79.3832,43.6532,1889-1902,Taught thirteen years in Ontario high schools and Collegiate Institute; specialty mathematics and natural science,,,,,,,,,,,Yale (Student),-72.9279,41.3083,undefined,Student at Yale,"Forestry Branch, Dept of Interior, Ottawa, ON, Canada",-75.6972,45.4215,1906-1907,"Technical assistant in Forestry Branch, Dept of Interior, Ottawa","University of Toronto, Toronto, ON, Canada",-79.3832,43.6532,1907-present,Lecturer in forestry at University of Toronto (appointed Oct 1907),"Canadian Pacific Railway, Calgary, AB, Canada",-114.0719,51.0447,1912-present,"Consulting forester, Dept of Natural Resources, Canadian Pacific Railway, Calgary (since May 1912)",,,,,,,,,,,,,,,,,,,,,,,,,,,,,,,1906
