Hugh G. Calkins,N,"Rockport (Lakewood), Ohio","Berkeley, California",-122.2595,37.8716,1906,Prepared at Berkeley High School; received B.S. from University of California 1906,"Swarthmore, Pennsylvania",-75.3521,39.9023,,Prepared at Swarthmore Preparatory School,,,,,,,,,,,,,,,,,,,,,Yale (Student),-72.9279,41.3083,undefined,Student at Yale,California,-119.4179,36.7783,1906-1907,Employed in United States Forest Service in California,Arizona / New Mexico,-109,34,1908-1911,Appointed forest assistant after leaving Yale Forest School (July 1908); deputy forest supervisor (July 1909),"Albuquerque, New Mexico",-106.6504,35.0844,1911-,"Supervisor of Zuni National Forest, headquarters Albuquerque, NM (since June 1, 1911)",,,,,,,,,,,,,,,,,,,,,,,,,,,,,,,1909
William E. Dunham,N,"Stoneboro, Pennsylvania","Warren, Pennsylvania",-79.1445,41.8431,,"Prepared at high school in Warren, PA","New Haven, Connecticut",-72.9279,41.3083,1908,Graduated from Sheffield Scientific School at Yale 1908; member of Theta Psi,,,,,,,,,,,,,,,,,,,,,Yale (Student),-72.9279,41.3083,undefined,Student at Yale,Pennsylvania Railroad forestry department,-76,40,1910-1912,"Forest assistant in forestry department of the Pennsylvania Railroad (July 1, 1910 to February 15, 1912)","Norfolk, Virginia",-76.2859,36.8508,1911-1912,"Leave of absence; estimated timber and made timber examinations for John L. Roper Lumber Company (November 15, 1911 to February 1, 1912)","Pittsburgh, Pennsylvania",-79.9959,40.4406,1912-,"Forester and Pittsburgh manager for Peters, Byrne & Company, foresters and entomologists (since March 1, 1912)",,,,,,,,,,,,,,,,,,,,,,,,,,,,,,,1909
H. Julian C. Humphrey,N,"London, England","Brooklyn, New York",-73.9442,40.6782,1908,Prepared at Adelphi Academy; received Ph.B. at Yale 1908; member of Theta Xi; attended Yale Forest School 1907-08 and until spring 1908-09,,,,,,,,,,,,,,,,,,,,,,,,,,Yale (Student),-72.9279,41.3083,undefined,Student at Yale,"Boston, Massachusetts",-71.0589,42.3601,1909,"Went to work for Fisher, Cary & Bryant, foresters, Boston, MA (September 1909); present occupation not known",,,,,,,,,,,,,,,,,,,,,,,,,,,,,,,,,,,,,,,,,1909
Richard L. Lovell,N,,"New Haven, Connecticut",-72.9279,41.3083,1907,"Graduated from Sheffield Scientific School, Yale University in 1907",,,,,,,,,,,,,,,,,,,,,,,,,,Yale (Student),-72.9279,41.3083,undefined,Student at Yale,"New Haven, Connecticut",-72.9279,41.3083,,Studying in Yale Graduate and Divinity schools; working in the city among boys,,,,,,,,,,,,,,,,,,,,,,,,,,,,,,,,,,,,,,,,,1909
Axel E. T. Moberg,N,"Refteled, Sweden","Jonkoping, Sweden",14.1618,57.7826,,Prepared at Yonkopings hogre allmanna lavoverk,"Uppsala, Sweden",17.6389,59.8586,1900-1906,Attended Uppsala University from 1900 to 1906,,,,,,,,,,,,,,,,,,,,,Yale (Student),-72.9279,41.3083,undefined,Student at Yale,Germany,10.4515,51.1657,,Reported to be in Germany (address not secured),,,,,,,,,,,,,,,,,,,,,,,,,,,,,,,,,,,,,,,,,1909
Ernest C. Wheeler,N,"Norwalk, Connecticut","Norwalk, Connecticut",-73.4079,41.1177,,Prepared at Norwalk University School and Connecticut Military Academy,"New Haven, Connecticut",-72.9279,41.3083,1907,Received B.A. from Yale University 1907,,,,,,,,,,,,,,,,,,,,,Yale (Student),-72.9279,41.3083,undefined,Student at Yale,"Brooklyn, New York",-73.9442,40.6782,1912-,"Assistant sales and advertising manager of J. & T. Cousins Company of Brooklyn, NY (since April 1912)",,,,,,,,,,,,,,,,,,,,,,,,,,,,,,,,,,,,,,,,,1909
Walter G. Alpaugh,Y,"Willimantic, Connecticut","Willimantic, Connecticut",-72.2065,41.7109,1883-1908,Birthplace; grew up here,"Medford, Massachusetts",-71.1067,42.4184,1904-1908,"Tufts College, received B.S. 1908; member Theta Delta Chi",,,,,,,,,,,,,,,,,,,,,Yale (Student),-72.9279,41.3083,undefined,Student at Yale,"Willimantic, Connecticut",-72.2065,41.7109,1910-1912,Engaged in lumbering and forestry with firm of Stetson & Alpaugh after graduation,"Springfield, Illinois",-89.6501,39.7817,1912-,"Clerk for Inter Ocean Life & Casualty Company (insurance); started Oct 1, 1912",,,,,,,,,,,,,,,,,,,,,,,,,,,,,,,,,,,,1910
William G. Baxter,Y,"Galva, Iowa","Galva, Iowa",-90.0429,41.1836,1885-,Birthplace; prepared at Galva High School,"Ames, Iowa",-93.6208,42.0308,-1908,"Iowa State College, received B.S.A. 1908","Caldwell, Idaho",-116.6874,43.6629,1908-1911,Engaged in reclamation work,,,,,,,,,,,,,,,,Yale (Student),-72.9279,41.3083,undefined,Student at Yale,"Aspen, Colorado",-106.8175,39.1911,1911-,"Forest assistant in the US Forest Service, Sopris Forest; started April 15, 1911",,,,,,,,,,,,,,,,,,,,,,,,,,,,,,,,,,,,,,,,,1910
"George A. Bright, 2d",Y,"Winchester, Massachusetts","Winchester, Massachusetts",-71.137,42.4534,1883-,Birthplace,"Hanover, New Hampshire",-72.2898,43.7022,-1908,"Dartmouth College, received B.S. 1908",,,,,,,,,,,,,,,,,,,,,Yale (Student),-72.9279,41.3083,undefined,Student at Yale,"Heppner, Oregon",-119.5529,45.3529,1910-,"Forest assistant, US Forest Service, Umatilla Forest; stationed at Heppner",,,,,,,,,,,,,,,,,,,,,,,,,,,,,,,,,,,,,,,,,1910
Donald Bruce,Y,"Newtonville, Massachusetts","Easthampton, Massachusetts",-72.6688,42.2676,,"Prepared at Williston Academy, Easthampton","New Haven, Connecticut",-72.9279,41.3083,1902-1906,"Yale College, graduated 1906; member Phi Beta Kappa, Sigma Xi, Psi Upsilon, etc.","Easthampton, Massachusetts",-72.6688,42.2676,1906-1908,Taught mathematics and physics at Williston Seminary,,,,,,,,,,,,,,,,Yale (Student),-72.9279,41.3083,undefined,Student at Yale,"Helena, Montana",-112.027,46.5958,1910-1911,"Forest assistant, Helena National Forest; entered Service July 1, 1910","Coeur d'Alene, Idaho",-116.7807,47.6777,1911-1912,"Forest assistant, Coeur d'Alene National Forest (transferred ~1911)","Missoula, Montana",-113.994,46.8721,1913-,"Forest assistant, US Forest Service headquarters at Missoula; current assignment Jan 1913",,,,,,,,,,,,,,,,,,,,,,,,,,,,,,,1910
Charles R. Clark,Y,"Carthage, Illinois","Champaign, Illinois",-88.2434,40.1164,1903-1904,Studied at University of Illinois 1903-04,"Madison, Wisconsin",-89.4012,43.0731,1904-1909,"University of Wisconsin, Class of 1907; received B.A. 1909; also worked for US Forest Service summer 1906",,,,,,,,,,,,,,,,,,,,,Yale (Student),-72.9279,41.3083,undefined,Student at Yale,"Dillon, Montana",-112.6366,45.2166,1910-,Forest assistant since graduation 1910; headquarters for Beaverhead National Forest,,,,,,,,,,,,,,,,,,,,,,,,,,,,,,,,,,,,,,,,,1910
Guy C. Cleveland,Y,"Albany, New York","Watertown, Connecticut",-73.1151,41.6032,,Prepared at Taft School,"New Haven, Connecticut",-72.9279,41.3083,1904-1908,"Yale College, graduated 1908; captain 1908 Freshman Football Team; member Delta Kappa Epsilon",,,,,,,,,,,,,,,,,,,,,Yale (Student),-72.9279,41.3083,undefined,Student at Yale,"Johnsonburg, Pennsylvania",-78.6589,41.4912,1910-1911,Forester for New York and Pennsylvania Paper & Pulp Company,"New York City, New York",-74.006,40.7128,1911-1912,"Manager, New York office of R. E. Boyd Company, wholesale lumber dealers","Butler, New Jersey",-74.3432,41.0026,1912-,"Incorporated North Jersey Excelsior Company Jan 24, 1912 with W.K. Wildes; secretary and treasurer",,,,,,,,,,,,,,,,,,,,,,,,,,,,,,,1910
Hamilton M. Coan,Y,"New York City, New York","Montclair, New Jersey",-74.209,40.8259,,Prepared at Montclair High School,"Princeton, New Jersey",-74.6596,40.3573,1903-1907,"Princeton University, received B.A. 1907",,,,,,,,,,,,,,,,,,,,,Yale (Student),-72.9279,41.3083,undefined,Student at Yale,"Chelan, Washington",-120.0224,47.844,1910-1912,"Forest assistant, Chelan National Forest; timber estimating and managing timber sale (~2 years)","Sumpter, Oregon",-118.1974,44.8693,1912-,"Forest assistant, Whitman National Forest (Oregon); intensive reconnaissance, mapping topography, forest types",,,,,,,,,,,,,,,,,,,,,,,,,,,,,,,,,,,,1910
George A. Cromie,Y,"Scotstown, Quebec, Canada",,,,,,,,,,,,,,,,,,,,,,,,,,,,,,,Yale (Student),-72.9279,41.3083,undefined,Student at Yale,Canada,-75.6972,45.4215,1910-1911,Forest assistant for the Canadian Government (fall 1910),"New Haven, Connecticut",-72.9279,41.3083,1911-,Superintendent of trees for the City of New Haven; returned 1911,,,,,,,,,,,,,,,,,,,,,,,,,,,,,,,,,,,,1910
Robert E. Dickson,Y,"Akron, Ohio","East Lansing, Michigan",-84.4832,42.736,-1909,"Michigan Agricultural College, received B.S. 1909 (courses in agriculture and forestry)",,,,,,,,,,,,,,,,,,,,,,,,,,Yale (Student),-72.9279,41.3083,undefined,Student at Yale,"Chicago, Illinois",-87.6298,41.8781,1910-1912,Taught biology and agriculture at Highland Park Polytechnical Institute; also brief forest assistant work after graduation,"Boise, Idaho",-116.2023,43.615,1912-,"Teacher at Boise High School (biology/agriculture) since Sept 1, 1912; also director of Boise District State Experiment Station",,,,,,,,,,,,,,,,,,,,,,,,,,,,,,,,,,,,1910
Richard C. Eggleston,Y,"Brandy, Virginia","Philadelphia, Pennsylvania",-75.1652,39.9526,,"Prepared at Central High School, Philadelphia; studied one year at University of Pennsylvania","New Haven, Connecticut",-72.9279,41.3083,-1909,"Sheffield Scientific School at Yale, graduated 1909; member Book and Bond, Southern Club",,,,,,,,,,,,,,,,,,,,,Yale (Student),-72.9279,41.3083,undefined,Student at Yale,"Various, Arizona/Southwest",-111.0937,34.0489,1910-1911,"Forest assistant, US Forest Service; entered July 1, 1910","Jenkins, Kentucky",-82.6274,37.1762,1911-1912,Forester for Consolidation Coal Company; resigned Forest Service July 1911,"Saint Maries, Idaho",-116.5749,47.3149,1912-,"Forest assistant, US Forest Service, headquarters St. Maries; re-entered Service Jan 1912",,,,,,,,,,,,,,,,,,,,,,,,,,,,,,,1910
Robie M. Evans,Y,"Fryeburg, Maine","Hanover, New Hampshire",-72.2898,43.7022,-1906,"Dartmouth College, received B.A. 1906",New Hampshire,-71.5724,43.1939,1906-1908,Taught science at Kimball Union Academy two years following graduation,,,,,,,,,,,,,,,,,,,,,Yale (Student),-72.9279,41.3083,undefined,Student at Yale,Oregon (various forests),-120.5542,43.8041,1910-,"Forest assistant on Oregon, Wallowa, Deschutes, and Malheur National Forests","Portland, Oregon",-122.6765,45.5231,-1913,"Located at district headquarters Portland, District 6; assigned to studies in silviculture",,,,,,,,,,,,,,,,,,,,,,,,,,,,,,,,,,,,1910
Harold Fay,Y,"Somerville, Massachusetts","Medford, Massachusetts",-71.1067,42.4184,-1904,"Tufts College, received B.A. 1904; member Theta Delta Chi","Worthington, Massachusetts",-72.9076,42.3476,1904-1905,Taught at Worthington High School one year,"Albany, New York",-73.7562,42.6526,1905,"With Newton Fire Brick Company of Albany, four months",New Hampshire woods,-71.5724,43.1939,1905-1908,Scaling and general laborer in New Hampshire woods for three years before Forest School,,,,,,,,,,,Yale (Student),-72.9279,41.3083,undefined,Student at Yale,"Batopilas, Chihuahua, Mexico",-107.726,27.027,1910,"Consulting forester for Batopilas Mining Company, June-Oct 1910","Madera, Chihuahua, Mexico",-108.198,29.193,1910-1911,"Saw boss, scaler, skidder for Madera Company Ltd., two months","New Haven, Connecticut",-72.9279,41.3083,1911,"Agent for Connecticut Mutual Life Insurance Company, Jan-Feb 1911; then assisted Prof. Bryant at Yale Forest School Camp, May-June 1911","Trinity, Texas",-95.3788,30.946,1911,"Assisted Professor Bryant at Yale Forest School Camp at Trinity, Texas","Newbern, North Carolina",-77.0441,35.1085,1911-1912,"Timberman and surveyor for John L. Roper Lumber Company, July 1911 to June 1912","Winchester, Massachusetts",-71.137,42.4534,1912-,Purchased farm; plans to combine scientific agriculture and consulting forestry,,,,,,,,,,,,,,,,1910
Max H. Foerster,Y,"New York City, New York","Sea Cliff, New York",-73.6468,40.8487,1889-1901,"Prepared at public schools at Sea Cliff, Long Island until 1901","Marburg, Germany",8.7667,50.8021,1901-1908,"Went abroad for seven years; attended Oberrealschule, Marburg, Hessen, Germany",,,,,,,,,,,,,,,,,,,,,Yale (Student),-72.9279,41.3083,undefined,Student at Yale,"Coconino, Arizona",-111.6513,35.1983,1910-1912,"Forest assistant US Forest Service 18 months: one year at Coconino Experiment Station, six months on Coconino National Forest","Jenkins, Kentucky",-82.6274,37.1762,1912-,Forester for Consolidation Coal Company of Kentucky; accepted position Jan 1912,,,,,,,,,,,,,,,,,,,,,,,,,,,,,,,,,,,,1910
William H. Gallaher,Y,"Santa Barbara, California","Santa Barbara, California",-119.6982,34.4208,,Prepared at Santa Barbara High School,"Berkeley, California",-122.2727,37.8716,,Attended University of California for two years before entering Yale,"New Haven, Connecticut",-72.9279,41.3083,-1909,"Sheffield Scientific School at Yale, graduated 1909",,,,,,,,,,,,,,,,Yale (Student),-72.9279,41.3083,undefined,Student at Yale,Europe and India,20,40,1910-1912,Spent eighteen months traveling in Europe and India for study purposes,"Tahoe National Forest, California",-120.5208,39.54,1910-,"Forest assistant, US Forest Service, Tahoe National Forest; entered Service July 1910",,,,,,,,,,,,,,,,,,,,,,,,,,,,,,,,,,,,1910
Harold P. Gilkey,Y,"Richland, Michigan","Cambridge, Massachusetts",-71.1097,42.3736,-1909,"Harvard University, received B.A. 1909",,,,,,,,,,,,,,,,,,,,,,,,,,Yale (Student),-72.9279,41.3083,undefined,Student at Yale,"Puget Sound, Washington",-122.4443,47.548,1910-1911,"Hydrographer, US Forest Service, cooperation with Geodetic Survey in Puget Sound region; July 1910 to July 1911","Sumpter, Oregon",-118.1974,44.8693,1911-,"Forest assistant, Whitman National Forest, headquarters Sumpter, Oregon",,,,,,,,,,,,,,,,,,,,,,,,,,,,,,,,,,,,1910
James L. Goodwin,Y,"New York City, New York","Groton, Massachusetts",-71.57,42.6101,,"Prepared at private schools in NYC and Groton School, Groton, Mass.","New Haven, Connecticut",-72.9279,41.3083,1901-1905,"Yale College, graduated 1905; member French Club; then studied law at Yale Law School one year",,,,,,,,,,,,,,,,,,,,,Yale (Student),-72.9279,41.3083,undefined,Student at Yale,"Vermont, Connecticut, New York, New Jersey",-72.5778,43.6245,1910-1913,Private practice of engineering and forestry; had NYC office with W.K. Wildes,"Hartford, Connecticut",-72.6851,41.7658,1913-,"Park work; appointed field secretary to Connecticut State Park Commission; formed James L. Goodwin Associates, landscape architects",,,,,,,,,,,,,,,,,,,,,,,,,,,,,,,,,,,,1910
Lester E. Hitchcock,Y,"Chicago, Illinois","Sioux Falls, South Dakota",-96.7003,43.5473,,Prepared at Sioux Falls High School; worked one year,"Yankton, South Dakota",-97.3973,42.8711,,Attended Yankton College two years,"Cedar Rapids, Iowa",-91.6441,41.9779,-1907,Graduated Coe College with B.S. 1907; taught high school one year before Yale,,,,,,,,,,,,,,,,Yale (Student),-72.9279,41.3083,undefined,Student at Yale,"Grand Canyon / Kaibab, Arizona",-112.1401,36.4427,1910-1911,"Reconnaissance work, District 4, going first to Kaibab Forest on northern border of Grand Canyon","Ogden, Utah",-111.9738,41.223,1911,Month at Ogden; also winter in Seattle with surveying/drafting work,"Sawtooth Forest, Idaho",-114.742,43.9065,1911,"Forest assistant, Sawtooth Forest; received four months furlough (unpleasant experience)","Vernal, Utah",-109.5287,40.4555,1912-,Deputy supervisor on Ashley National Forest; reconnaissance and varied tasks,,,,,,,,,,,,,,,,,,,,,,,,,,1910
Crosby A. Hoar,Y,"West Acton, Massachusetts","Groton, Massachusetts",-71.57,42.6101,,Prepared in common schools and Lawrence Academy,"Hanover, New Hampshire",-72.2898,43.7022,-1908,"Dartmouth, received B.A. 1908",,,,,,,,,,,,,,,,,,,,,Yale (Student),-72.9279,41.3083,undefined,Student at Yale,"Meeker, Colorado",-107.9142,40.0394,1910-,"Assistant then forest examiner, US Forest Service, White River Forest, headquarters Meeker; field assistant at Yale Forest School spring 1911 and 1912",,,,,,,,,,,,,,,,,,,,,,,,,,,,,,,,,,,,,,,,,1910
Stephen V. Klem,Y,"New Haven, Connecticut","New Haven, Connecticut",-72.9279,41.3083,-1909,"Boardman Manual Training High School; Sheffield Scientific School at Yale, graduated 1909; also worked as salesman 1905-06",,,,,,,,,,,,,,,,,,,,,,,,,,Yale (Student),-72.9279,41.3083,undefined,Student at Yale,"Denver, Colorado",-104.9903,39.7392,1910,"About four months in office of silviculture, District 2, Denver","Medicine Bow Forest, Wyoming",-106.3109,41.3572,1910-1911,About two months on winter reconnaissance on Medicine Bow Forest,"Custer, South Dakota",-103.5971,43.7677,1911-1912,"Forest assistant, Harney National Forest, headquarters Custer, SD; until April 1912","New Haven, Connecticut",-72.9279,41.3083,1912-1913,Leave of absence; special investigation on taxation of forest land in CT under CT State Forester; station assistant at CT Agricultural Experiment Station,"East Lansing, Michigan",-84.4832,42.736,1913-,Conducted two lecture courses at Michigan Agricultural College; expects to continue another year,,,,,,,,,,,,,,,,,,,,,1910
Julius A. Larsen,Y,"Drammen, Norway",Norway (seafaring),10.3951,63.4305,1877-,Born in Norway; spent four years at sea; four years in manufacturing concerns including Winchester Repeating Arms Co.,"New Haven, Connecticut",-72.9279,41.3083,-1908,"Yale College, graduated 1908; received oration appointment; member Scandinavian Club",,,,,,,,,,,,,,,,,,,,,Yale (Student),-72.9279,41.3083,undefined,Student at Yale,"Kalispell, Montana",-114.3127,48.192,1910-1913,"Forest assistant, Blackfoot National Forest; lumber reconnaissance, mapping, planting and studies; entered Service July 1, 1910","Priest River, Idaho",-116.9107,48.1802,1913-,"Transferred to Priest River Experiment Station, April 1913",,,,,,,,,,,,,,,,,,,,,,,,,,,,,,,,,,,,1910
Raymond E. Marsh,Y,"Swanzey, New Hampshire","Keene, New Hampshire",-72.2776,42.9337,,Prepared at Keene High School,"Hanover, New Hampshire",-72.2898,43.7022,-1908,"Dartmouth, received B.S. 1908",,,,,,,,,,,,,,,,,,,,,Yale (Student),-72.9279,41.3083,undefined,Student at Yale,"Springerville, Arizona",-109.2887,34.1336,1910-1911,"Forest assistant, Apache National Forest; entered Forest Service July 1910","Tres Piedras, New Mexico",-105.9619,36.6467,1911-,"Reconnaissance then deputy forest supervisor, Carson Forest; appointed fall 1912",,,,,,,,,,,,,,,,,,,,,,,,,,,,,,,,,,,,1910
Frank B. Notestein,Y,"Wooster, Ohio","Wooster, Ohio",-81.9346,40.8051,-1908,"University of Wooster, received Ph.B. 1908; camped seven summers in northern Michigan; two summers as forest guard on San Juan National Forest",,,,,,,,,,,,,,,,,,,,,,,,,,Yale (Student),-72.9279,41.3083,undefined,Student at Yale,"Manitou, Colorado",-104.9155,38.8597,1910-1912,"Forest assistant then in charge of Fremont Experiment Station at Manitou, connection with Pike National Forest; entered Service July 1910","Wagon Wheel Gap, Colorado",-106.8161,37.7581,1912-,Forest examiner at Wagon Wheel Gap Experiment Station; in this position since July 1912,,,,,,,,,,,,,,,,,,,,,,,,,,,,,,,,,,,,1910
Mauricio J. Oteyza,Y,"Binondo, Manila, Philippine Islands","Manila, Philippine Islands",120.9842,14.5995,1886-1902,"Student for B.A. at Jesuit College, Manila until 1902; then business office, Philippine Normal School, teaching in Government public school","Manhattan, Kansas",-96.5836,39.1836,1905-1910,"Kansas State Agricultural College, received B.S. 1910; corporal in cadet band",,,,,,,,,,,,,,,,,,,,,Yale (Student),-72.9279,41.3083,undefined,Student at Yale,"Los Bańos, Laguna, Philippine Islands",121.2428,14.1714,1910-,"Assistant forester then instructor in silviculture and forest management, Bureau of Forestry, Philippine Islands; appointed Feb 1910",,,,,,,,,,,,,,,,,,,,,,,,,,,,,,,,,,,,,,,,,1910
Dana Parkinson,Y,"Fergus Falls, Minnesota","Waltham, Massachusetts",-71.2356,42.3765,,"Home address Waltham, Mass.","Hanover, New Hampshire",-72.2898,43.7022,-1908,"Dartmouth, received B.A. 1908",,,,,,,,,,,,,,,,,,,,,Yale (Student),-72.9279,41.3083,undefined,Student at Yale,"Boise, Idaho",-116.2023,43.615,1910-,"Forest assistant, US Forest Service, Boise National Forest; since July 1, 1910",,,,,,,,,,,,,,,,,,,,,,,,,,,,,,,,,,,,,,,,,1910
Stuart B. Show,Y,"Waco, Nebraska","Palo Alto, California",-122.143,37.4419,,Prepared at grammar and high schools of Palo Alto,"Stanford, California",-122.1697,37.4275,-1908,"Leland Stanford Jr. University, received B.A. 1908",,,,,,,,,,,,,,,,,,,,,Yale (Student),-72.9279,41.3083,undefined,Student at Yale,"Sisson, California",-122.3172,41.3099,1910-,"Assistant, US Forest Service, Shasta National Forest, headquarters Sisson; since July 1910",,,,,,,,,,,,,,,,,,,,,,,,,,,,,,,,,,,,,,,,,1910
William N. Sparhawk,Y,"West Swanzey, New Hampshire","West Swanzey, New Hampshire",-72.3265,42.8501,,Prepared at public schools in West Swanzey and Keene High School,"New Haven, Connecticut",-72.9279,41.3083,-1908,"Yale College, graduated 1908; member Phi Beta Kappa, Alpha Sigma Phi, Hispanic Club",,,,,,,,,,,,,,,,,,,,,Yale (Student),-72.9279,41.3083,undefined,Student at Yale,"Salmon National Forest, Idaho",-114.0888,45.1772,1910-1911,"Forest assistant, Salmon National Forest; entered Service July 1910","Sevier National Forest, Utah",-111.9571,38.5263,1911-1912,"Forest assistant, Sevier National Forest","Emmett, Idaho",-116.4932,43.8721,1912-,"Forest assistant, US Forest Service, Payette National Forest, headquarters Emmett",,,,,,,,,,,,,,,,,,,,,,,,,,,,,,,1910
Irving G. Stetson,Y,"Bangor, Maine","Milton, Massachusetts",-71.0662,42.2501,1898-1899,Prepared at Milton Academy 1898-99,"Andover, Massachusetts",-71.137,42.6584,1899-1903,"Phillips Academy, Andover 1899-03","Cambridge, Massachusetts",-71.1097,42.3736,1903-1907,"Harvard, received B.A. 1907; member Hasty Pudding Club",,,,,,,,,,,,,,,,Yale (Student),-72.9279,41.3083,undefined,Student at Yale,"Bangor, Maine",-68.7712,44.8016,1910-,"Member of firm Stetson & Alpaugh (later I.G. Stetson & Company), lumbermen and foresters; lumbering in spruce and pine; director Penobscot Log Driving Company and First National Bank of Bangor (1911)",,,,,,,,,,,,,,,,,,,,,,,,,,,,,,,,,,,,,,,,,1910
Albert O. Vorse,Y,"Lewisburg, Pennsylvania","Lewisburg, Pennsylvania",-76.8844,40.9651,-1905,"Bucknell University, received B.S. 1905; then newspaper work 18 months, surveying one year; M.S. Bucknell 1911",,,,,,,,,,,,,,,,,,,,,,,,,,Yale (Student),-72.9279,41.3083,undefined,Student at Yale,Pennsylvania,-77.1945,41.2033,1910-1912,Employed in Pennsylvania State Forest Service; also assistant superintendent of woodlands for Delaware & Hudson Railroad,"Ardmore, Pennsylvania",-75.2935,40.0062,1912-,"Forester for Peters, Byrne & Company of Ardmore, PA; since March 1912",,,,,,,,,,,,,,,,,,,,,,,,,,,,,,,,,,,,1910
Robert S. Wallace,Y,"Wooster, Ohio","Saint Paul, Minnesota",-93.09,44.9537,,Macalester College (also in St. Paul); received B.A. 1908,,,,,,,,,,,,,,,,,,,,,,,,,,Yale (Student),-72.9279,41.3083,undefined,Student at Yale,"Pecos National Forest, New Mexico",-105.6747,35.5677,1910-1911,"Reconnaissance work, District 3; first appointment on Pecos National Forest",Datil/Arkansas National Forests,-107.7856,34.0242,1911-1912,Reconnaissance and experimental sample plot work on Datil and Arkansas National Forests,"Harrison, Arkansas",-93.1077,36.2298,1912-,"Ozark Forest then timber sale work; headquarters Harrison, Arkansas; since summer 1912",,,,,,,,,,,,,,,,,,,,,,,,,,,,,,,1910
Edgar F. White,Y,"Danvers, Massachusetts","Hanover, New Hampshire",-72.2898,43.7022,-1908,"Dartmouth, received B.A. 1908; member Phi Gamma Delta",,,,,,,,,,,,,,,,,,,,,,,,,,Yale (Student),-72.9279,41.3083,undefined,Student at Yale,"Custer National Forest, Montana",-108.2151,45.9153,1910-1912,"Forest assistant, Custer National Forest; entered Service July 1910; until April 1912","Madison Forest, Montana",-111.6413,44.9429,1912,"Forest assistant, Madison Forest, two months","Missoula, Montana",-113.994,46.8721,1912-,Planting department of District 1; acting chief of planting,,,,,,,,,,,,,,,,,,,,,,,,,,,,,,,1910
Walter K. Wildes,Y,"Skowhegan, Maine","Brunswick, Maine",-69.965,43.9145,-1904,"Bowdoin College, received B.A. 1904; member Delta Kappa Epsilon; then in manufacture/selling of worsteds; summer 1902 valuation surveys Great Northern Paper Co.; summer 1903 studying poplars in Dead River region, Maine",,,,,,,,,,,,,,,,,,,,,,,,,,Yale (Student),-72.9279,41.3083,undefined,Student at Yale,Vermont,-72.5778,43.6245,1910-1912,Assistant state forester of Vermont after graduation 1910,"Butler, New Jersey",-74.3432,41.0026,1912-,President of North Jersey Excelsior Company (manufacturers of excelsior); since January 1912,,,,,,,,,,,,,,,,,,,,,,,,,,,,,,,,,,,,1910
B. Frank Heintzleman,Certificate,"Fayetteville, Pennsylvania","Mont Alto, Pennsylvania",-77.5577,39.8362,-1907,"Pennsylvania State Forest Academy, received Bachelor of Forestry 1907; worked as forester in PA dept of forestry nine months before Yale",,,,,,,,,,,,,,,,,,,,,,,,,,Yale (Student),-72.9279,41.3083,undefined,Student at Yale,"Sumpter, Oregon",-118.1974,44.8693,1910-,"Forest assistant, US Forest Service, Whitman National Forest, headquarters Sumpter; since July 1910",,,,,,,,,,,,,,,,,,,,,,,,,,,,,,,,,,,,,,,,,1910
Sedman W. Wynne,Certificate,"Butte, Montana","Berkeley, California",-122.2727,37.8716,,Attended University of California before Yale Forest School,"Mining sites, Western USA",-119.4179,36.7783,1904-1908,Mining engineer 1904-1908,,,,,,,,,,,,,,,,,,,,,Yale (Student),-72.9279,41.3083,undefined,Student at Yale,"Various, US Forest Service",-119.4179,36.7783,1910-1912,"Forest assistant, US Forest Service; July 1910 to July 1912","Hot Springs, Tulare County, California",-118.5126,36.3009,1912-,"Deputy forest supervisor, Sequoia National Forest; appointed July 1912",,,,,,,,,,,,,,,,,,,,,,,,,,,,,,,,,,,,1910
