Robert E. Clark,Y,"New Haven, Connecticut","New Haven, Connecticut",-72.9279,41.3083,1886–1907,"Boardman Manual Training School, New Haven; Sheffield Scientific School Yale, graduated 1907",,,,,,,,,,,,,,,,,,,,,,,,,,Yale (Student),-72.9279,41.3083,undefined,Student at Yale,United States Forest Service (various),-98,38,1908–1909,"Forest assistant, US Forest Service, 1908 to July 15 1909","Leadville, Colorado",-106.2925,39.2503,1909–1913,"Acting supervisor, US Forest Service, HQ Leadville, Colorado, from July 15 1909",,,,,,,,,,,,,,,,,,,,,,,,,,,,,,,,,,,,1908
Arthur M. Cook,Y,"Laconia, New Hampshire","Laconia, New Hampshire",-71.4698,43.5276,1883–c.1900,One year in New England Telephone & Telegraph Company,"Exeter, New Hampshire",-70.9478,42.9815,c.1900–1902,"Phillips Exeter Academy, two years","Cambridge, Massachusetts",-71.1056,42.3736,1902–1906,"Harvard University, B.A. 1906; member Theta Delta Chi",,,,,,,,,,,,,,,,Yale (Student),-72.9279,41.3083,undefined,Student at Yale,United States Forest Service (various),-98,38,1908–1910,"Forest assistant then deputy forest supervisor, US Forest Service","Fraser, Colorado (Arapaho NF)",-105.8192,39.9443,1910–1913,"Supervisor of Arapaho National Forest, HQ Fraser, Colorado, from July 1910",,,,,,,,,,,,,,,,,,,,,,,,,,,,,,,,,,,,1908
John A. Ferguson,Y,"Canandaigua, New York","Canandaigua, New York",-77.2836,42.8895,1873–1896,Canandaigua Academy; B.A. Hamilton College 1896; M.A. Hamilton 1903; member Chi Psi and Delta Theta Sigma,"Brooklyn, New York",-73.9442,40.6782,c.1896–c.1905,Taught at Brooklyn Polytechnic Institute,"New Brunswick, New Jersey",-74.4496,40.4862,c.1905–1906,Taught at Rutgers Preparatory School,,,,,,,,,,,,,,,,Yale (Student),-72.9279,41.3083,undefined,Student at Yale,"Boise National Forest, Idaho",-115.8,43.8,1908,"Forest assistant, US Forest Service, Boise National Forest","State College, Pennsylvania",-77.86,40.7934,1908–1911,"Instructor then assistant professor of forestry, Pennsylvania State College 1908; assistant professor 1909; in charge of department 1909–10; acted as instructor Yale Forestry Camp summer 1910–11","Columbia, Missouri",-92.3341,38.9517,1911–1913,Founded forestry department at University of Missouri 1911; held professorship of forestry,"State College, Pennsylvania",-77.86,40.7934,1913,"Director of College of Forestry at Pennsylvania State College, from January 1913",,,,,,,,,,,,,,,,,,,,,,,,,,1908
H. Earl French,Y,"Humboldt, Iowa","Humboldt, Iowa",-94.2169,42.7205,1883–c.1902,Humboldt High School,"Iowa City, Iowa",-91.5302,41.6611,c.1902–1906,"State University of Iowa, B.S. 1906",,,,,,,,,,,,,,,,,,,,,Yale (Student),-72.9279,41.3083,undefined,Student at Yale,"Halsey, Nebraska (Nebraska NF)",-100.267,41.9044,1908–1913,"US Forest Service from July 1 1908; supervisor of Nebraska National Forest, HQ Halsey, Nebraska",,,,,,,,,,,,,,,,,,,,,,,,,,,,,,,,,,,,,,,,,1908
Jesse R. Hall,Y,"Blendon, Michigan","El Cajon, California",-116.9625,32.7948,c.1895–1901,El Cajon Union High School,"Berkeley, California",-122.2727,37.8716,c.1901–1905,"University of California, B.S. 1905",,,,,,,,,,,,,,,,,,,,,Yale (Student),-72.9279,41.3083,undefined,Student at Yale,"Plumas National Forest, California",-120.7,40,1908–1910,"Forest assistant, Plumas National Forest, California","Klamath National Forest, California (Yreka)",-122.6317,41.7354,1910–1913,"Deputy forest supervisor, US Forest Service, HQ Klamath National Forest (Yreka, Siskiyou County), from January 1 1910",,,,,,,,,,,,,,,,,,,,,,,,,,,,,,,,,,,,1908
R. Clifford Hall,Y,"Chicago, Illinois","Chicago, Illinois",-87.6298,41.8781,1885–c.1902,"Chicago public schools; Lake View High School, Chicago","Evanston, Illinois",-87.6877,42.0451,c.1902–1906,"Northwestern University, B.S. 1906; elected to Phi Beta Kappa",,,,,,,,,,,,,,,,,,,,,Yale (Student),-72.9279,41.3083,undefined,Student at Yale,"Washington, D.C.",-77.0369,38.9072,1908–1913,"Forest assistant, US Forest Service, HQ Washington D.C., from July 1 1908; traveled professionally in Illinois, Kentucky, Tennessee, North Carolina and Georgia; sight-seeing trip to Yellowstone Park 1910",,,,,,,,,,,,,,,,,,,,,,,,,,,,,,,,,,,,,,,,,1908
William C. Latané,Y,"Oak Grove, Virginia",Virginia,-77.4316,37.5407,c.1888–c.1901,Wirtland Seminary,"Blacksburg, Virginia",-80.4139,37.2296,c.1901–1905,"Virginia Polytechnic Institute, B.S. 1905",,,,,,,,,,,,,,,,,,,,,Yale (Student),-72.9279,41.3083,undefined,Student at Yale,"Bighorn National Forest, Wyoming",-107.4,44.4,1908–1909,"Forest assistant, US Forest Service, HQ Bighorn National Forest 1908–09","Kaniksu National Forest, Idaho",-116.5,48.5,1909–1910,"Forest assistant, Kaniksu National Forest 1909–10","Kootenai National Forest, Montana (Libby)",-115.4,48.5,1910–1913,"Forest assistant 1910–1913, Kootenai National Forest District 1; deputy supervisor by 1913; HQ Libby, Montana",,,,,,,,,,,,,,,,,,,,,,,,,,,,,,,1908
Charles A. Lewis,Y,"New London, Connecticut","Hartford, Connecticut",-72.6851,41.7658,c.1877–1893,"Trinity College, B.A. 1893; member Delta Psi",,,,,,,,,,,,,,,,,,,,,,,,,,Yale (Student),-72.9279,41.3083,undefined,Student at Yale,United States Forest Service (various),-98,38,1908–1909,"Forest assistant, US Forest Service, July 1908 to January 1909",Various,-98,38,1910–1911,Engaged in hardware business 1910–11,"Ithaca, New York",-76.4969,42.444,c.1911–1913,Student at Cornell University,,,,,,,,,,,,,,,,,,,,,,,,,,,,,,,1908
Forman T. McLean,Y,"Colt's Neck, New Jersey","Red Bank, New Jersey",-74.0735,40.3468,c.1891–c.1903,Red Bank High School; Shrewsbury Academy,"New Haven, Connecticut",-72.9279,41.3083,c.1903–1907,"Sheffield Scientific School Yale, graduated 1907",,,,,,,,,,,,,,,,,,,,,Yale (Student),-72.9279,41.3083,undefined,Student at Yale,United States Forest Service (various),-98,38,1908–1911,"Forest assistant, US Forest Service, from July 1 1908 through Nov 30 1911","Ephraim, Utah",-111.5888,39.3594,1911–1913,"Deputy supervisor, US Forest Service, HQ Ephraim, Utah, from December 1 1911",,,,,,,,,,,,,,,,,,,,,,,,,,,,,,,,,,,,1908
Harvey R. MacMillan,Y,"Newmarket, Ontario, Canada","Brooklyn, New York / Worcester, Massachusetts",-73.9442,40.6782,c.1891–c.1902,Adelphi Academy and Worcester High School,"Guelph, Ontario, Canada",-80.2482,43.5448,c.1902–1906,"Ontario Agricultural College, Toronto University, B.S.A. 1906; summers with Dominion Forestry Branch since 1903; charge of first forest survey in Canada",,,,,,,,,,,,,,,,,,,,,Yale (Student),-72.9279,41.3083,undefined,Student at Yale,Canada (Dominion Forestry Branch),-96,57,1908–1911,"Assistant inspector of forest reserves, Dominion Forestry Branch 1908–1911",Canada (Dominion Forestry Branch),-96,57,1911–1912,"Assistant director of forestry, Dominion Forestry Branch 1911 to July 15 1912","Victoria, British Columbia, Canada",-123.3656,48.4284,1912–1913,Chief of Forest Branch of British Columbia from July 15 1912; administers public forest lands of province,,,,,,,,,,,,,,,,,,,,,,,,,,,,,,,1908
Willis N. Millar,Y,"Pittsburgh, Pennsylvania","Pittsburgh, Pennsylvania",-79.9959,40.4406,1883–1906,"Pittsburgh High School; University of Pennsylvania, B.S. 1906",,,,,,,,,,,,,,,,,,,,,,,,,,Yale (Student),-72.9279,41.3083,undefined,Student at Yale,United States Forest Service (various),-98,38,1908–1912,US Forest Service: forest assistant then forest supervisor,"Calgary, Alberta, Canada",-114.0719,51.0447,1912–1913,"Inspector of forest reserves, Forestry Branch, Dept of Interior Canada, Alberta District, from March 13 1912",,,,,,,,,,,,,,,,,,,,,,,,,,,,,,,,,,,,1908
Robert B. Miller,Y,"Lincoln, Nebraska","Thorntown, Indiana",-86.6086,40.1334,c.1880–1896,Thorntown High School; B.S. Wabash College Crawfordsville 1896; honorary M.A. Wabash 1906; assistant principal Thorntown HS 1897–98; newspaper work following,"Rochester, Indiana",-86.2114,41.0645,1899–1903,"Professor of natural science at Rochester Normal School, 4 years; studied at University of Chicago summer 1899","Mitchell, South Dakota",-98.0298,43.7094,c.1903–1904,"Professor of natural science, Dakota Wesleyan",,,,,,,,,,,,,,,,Yale (Student),-72.9279,41.3083,undefined,Student at Yale,"Fredericton, New Brunswick, Canada",-66.6431,45.9636,1909–1913,"Dean of Department of Forestry, University of New Brunswick, from Sept 1909; founded dept 1908; appointed forester by Senate of UNB fall 1912 with charge of 3,600 acres of college lands",,,,,,,,,,,,,,,,,,,,,,,,,,,,,,,,,,,,,,,,,1908
Barrington Moore,Y,"Ossining, New York","Southboro, Massachusetts",-71.5245,42.3037,c.1892–c.1900,"St. Mark's School, Southboro; also Craigie's School","Morristown, New Jersey",-74.4774,40.7968,c.1900–1902,"Morristown School, Morristown NJ","New Haven, Connecticut",-72.9279,41.3083,1902–1906,"Yale College, graduated 1906; Alpha Delta Phi; student assistant in US Forest Service in North Carolina during junior year summer",,,,,,,,,,,,,,,,Yale (Student),-72.9279,41.3083,undefined,Student at Yale,"Albuquerque, New Mexico (District 3)",-106.6504,35.0844,1909,Entered Forest Service July 1 1909; sent to District 3 SW headquarters Albuquerque; reconnaissance—mapping and estimating timber,"Washington, D.C.",-77.0369,38.9072,1909–1913,"Forest examiner, US Forest Service; construction of working plans at Washington office from July 1909",,,,,,,,,,,,,,,,,,,,,,,,,,,,,,,,,,,,1908
Thornton T. Munger,Y,"North Adams, Massachusetts","New Haven, Connecticut",-72.9279,41.3083,c.1897–1905,New Haven High School; Hotchkiss School; Yale College graduated 1905; active in Dwight Hall work,Germany,10.4515,51.1657,1905–1906,Year abroad; three months devoted to study of forestry in Germany,,,,,,,,,,,,,,,,,,,,,Yale (Student),-72.9279,41.3083,undefined,Student at Yale,"Washington, D.C.",-77.0369,38.9072,1908,"Assigned to Section of Silvics, US Forest Service, July 1 1908; six weeks in Washington",Oregon (Cascades),-121.5,44,1908,"Sent to Oregon to study encroachment of lodgepole pine on western yellow pine, east slope Cascades; completed Dec 1 1908","Portland, Oregon",-122.6765,45.5231,1908–1913,"Chief of Section of Silvics in district office of Forest Service, Portland, Oregon, from Dec 1 1908; silvical studies in national forests of Oregon and Washington; field work for timber sales and reconnaissance",,,,,,,,,,,,,,,,,,,,,,,,,,,,,,,1908
Robert L. Rogers,Y,"Westerly, Rhode Island","Providence, Rhode Island",-71.4128,41.824,c.1889–1906,Public and private schools at Providence; Yale College graduated 1906; editor Yale Banner 1905; Elihu Club,,,,,,,,,,,,,,,,,,,,,,,,,,Yale (Student),-72.9279,41.3083,undefined,Student at Yale,Eastern & Midwestern United States,-90,38,1908,Forest Service July 1908; planting and cooperative examinations in East and Middle West until Dec 1908,Arizona & New Mexico,-111,34,1908–1912,"Forest and district work in Arizona and New Mexico, Dec 1908–Dec 1912; held positions of forest assistant, deputy forest supervisor, forest supervisor","Washington, D.C.",-77.0369,38.9072,1912–1913,"Editorial work for US Forest Service with position of forest examiner, from Dec 1912",,,,,,,,,,,,,,,,,,,,,,,,,,,,,,,1908
Julian E. Rothery,Y,"Longwood (Brookline area), Massachusetts","Wellesley, Massachusetts",-71.294,42.2968,c.1891–1907,"Wellesley High School; Sheffield Scientific School Yale, graduated 1907",,,,,,,,,,,,,,,,,,,,,,,,,,Yale (Student),-72.9279,41.3083,undefined,Student at Yale,"Cache National Forest, Utah",-111.8,41.8,1908–1910,"Forest assistant and deputy forest supervisor, Cache National Forest, Utah (~2 years); also charge of winter work in forestry dept of Utah State Agricultural College","Idaho National Forest, Idaho",-115.5,44.5,1910–1912,"Supervisor of Idaho National Forest, from July 1 1910; fought the great fire of 1910","Labrador Peninsula, Canada",-63,54,1912,"Exploring in Labrador Peninsula on snowshoes and dog teams, winter and summer 1912","New York City, New York",-74.006,40.7128,1912–1913,"Junior partner, Vitale & Rothery, landscape architects, from January 1 1912",,,,,,,,,,,,,,,,,,,,,,,,,,1908
Edward B. Starr,Y,"Northfield, Connecticut","Cornwall, Connecticut",-73.324,41.8412,c.1891–1907,"Housatonic Valley Institute, Cornwall; Yale College graduated 1907; first colloquy Junior appointment; member of baseball team",,,,,,,,,,,,,,,,,,,,,,,,,,Yale (Student),-72.9279,41.3083,undefined,Student at Yale,"Washington, D.C.",-77.0369,38.9072,1908,Entered Forest Service July 1 1908; stationed in Washington D.C.,"Portland, Oregon",-122.6765,45.5231,c.1908–1910,"Appointed to Portland, Oregon","Cascade National Forest, Oregon",-121.7,44.3,c.1910–1912,Appointed to Cascade National Forest,"Albany, Oregon (Santiam NF)",-123.1051,44.6365,c.1912–1913,"Forest assistant, US Forest Service, HQ Albany, Oregon; Santiam National Forest; state fire warden and deputy game warden",,,,,,,,,,,,,,,,,,,,,,,,,,1908
Dillon P. Tierney,Y,"Farmington, Minnesota","Farmington, Minnesota",-93.1519,44.6494,1882–c.1902,Farmington High School and agricultural school,"Minneapolis, Minnesota",-93.265,44.9778,c.1902–1906,"University of Minnesota, B.Sc.F. 1906; member Alpha Zeta",,,,,,,,,,,,,,,,,,,,,Yale (Student),-72.9279,41.3083,undefined,Student at Yale,Southern United States (Kaul Lumber Co.),-87,33,1908–c.1909,Forester for Kaul Lumber Company,United States Forest Service (various),-98,38,c.1909–1910,Employed in US Forest Service,"Minneapolis, Minnesota",-93.265,44.9778,c.1910–1911,"Instructor, University of Minnesota; placed in charge of Forest Experiment Station","St. Paul, Minnesota",-93.09,44.9537,1911–1913,"Assistant state forester of Minnesota, State Capitol St. Paul, from May 15 1911",,,,,,,,,,,,,,,,,,,,,,,,,,1908
Wilford B. Willey,Y,"Nunda, New York","Ithaca, New York",-76.4969,42.444,c.1896–1907,"Ithaca High School; Cornell University, B.A. 1907",,,,,,,,,,,,,,,,,,,,,,,,,,Yale (Student),-72.9279,41.3083,undefined,Student at Yale,"Saint Maries, Idaho",-116.5696,47.3149,1908–1913,"Forest assistant, US Forest Service, HQ Saint Maries, Idaho, from July 1 1908",,,,,,,,,,,,,,,,,,,,,,,,,,,,,,,,,,,,,,,,,1908
Hubert C. Williams,Y,"Lakeville, Connecticut","New Haven, Connecticut",-72.9279,41.3083,c.1890–1906,"Sheffield Scientific School Yale, graduated 1906; member Delta Phi",,,,,,,,,,,,,,,,,,,,,,,,,,Yale (Student),-72.9279,41.3083,undefined,Student at Yale,"Goodman, Wisconsin",-88.7512,45.6272,1908–1910,"Goodman Lumber Company, Goodman, Wisconsin, July 1908–July 1910; first postmaster of Goodman, Wisconsin","McCall, Idaho (Idaho NF)",-116.1,44.9046,1911–1913,Left home May 8 1911 for Ogden Utah with letter from district forester; arrived McCall as forest guard; soon made forest assistant; deputy supervisor of Idaho National Forest by 1913,,,,,,,,,,,,,,,,,,,,,,,,,,,,,,,,,,,,1908
Chester B. Cox,Certificate (not degree),"Santa Maria, California","Santa Maria, California",-120.4357,34.953,1883–c.1901,Santa Maria Union High School,"Berkeley, California",-122.2727,37.8716,c.1901–1908,"College of Agriculture, University of California (attended, did not specify degree)",,,,,,,,,,,,,,,,,,,,,Yale (Student),-72.9279,41.3083,undefined,Student at Yale,United States Forest Service (various),-98,38,1908–1909,"Forest assistant, US Forest Service, 1908–09","Bataan & Arayat, Philippine Islands",120.5,14.5,1909–1911,"Forester, Bureau of Forestry, Philippine Islands; in charge of Bataan and Arayat forests 1909–1911","North Central Luzon, Philippine Islands",120.6,15.8,1911–1912,In charge of North Central Luzon District 1911–12,"Baguio, Philippine Islands",120.596,16.4023,1912–1913,"HQ at Baguio since 1912; engaged in beautification of Baguio, Bureau of Forestry",,,,,,,,,,,,,,,,,,,,,,,,,,1908
Joseph A. Fitzwater,Certificate (not degree),"Phoenixville, Pennsylvania","Huntingdon, Pennsylvania",-77.9986,40.4834,c.1898–c.1902,Juniata College,"Phoenixville, Pennsylvania",-75.5157,40.1301,c.1902–1903,"One year with Phoenix Iron Works, clerical work","New Haven, Connecticut",-72.9279,41.3083,1903,Yale Summer School 1903; also student assistant in US Forest Service,,,,,,,,,,,,,,,,Yale (Student),-72.9279,41.3083,undefined,Student at Yale,"Flagstaff, Arizona (Coconino NF)",-111.6513,35.1983,1908,July 1908; one month reconnaissance on Coconino National Forest,"Denver, Colorado / Pike NF",-104.9903,39.7392,1908,Reported to Frank Vogel Denver; reconnaissance Pike National Forest until Nov; working plan report,"Missoula, Montana (District 1)",-113.994,46.8721,1908–1910,"Reported at Missoula District 1 Dec 1908; winter/spring 1909 worked on Kaniksu, Kootenai, Pend Oreille forests; July 1909 Absaroka deputy supervisor boundary work; North Fork Flathead River crew; Kaniksu Section 26; Jan 1910 Missoula district office volume tables and Ranger School teaching","Superior National Forest, Minnesota",-91.5,47.8,1910–1912,Sent to Superior National Forest as acting forest supervisor April 1910; became supervisor,"Pend Oreille National Forest, Idaho",-117,48.5,1912–1913,"Supervisor, US Forest Service, HQ Pend Oreille National Forest, from August 1912",,,,,,,,,,,,,,,,,,,,,1908
Francis M. Patton,Certificate (not degree),"Asheville, North Carolina","Sewanee, Tennessee",-85.9208,35.2034,c.1888–c.1896,"Grammar school in Sewanee, Tennessee","Asheville, North Carolina",-82.5515,35.5951,c.1896–c.1906,Biltmore Forest School; University of North Carolina (member Beta Theta Pi); US Forest Service student assistant 2 years before Yale,,,,,,,,,,,,,,,,,,,,,Yale (Student),-72.9279,41.3083,undefined,Student at Yale,United States Forest Service (various),-98,38,1908–1909,"Forest assistant, US Forest Service, July 1908 to December 1909",United States Forest Service (various),-98,38,1910–1911,"Deputy forest supervisor, January 1910 to September 1911","Asheville, North Carolina",-82.5515,35.5951,1911–1913,"Manager, Parker & Patton Apple Orchards, Asheville, NC, from November 1 1911",,,,,,,,,,,,,,,,,,,,,,,,,,,,,,,1908
Rutledge Parker,Certificate (not degree),"Georgetown County, South Carolina","Charleston, South Carolina",-79.9311,32.7765,c.1884–1898,"Porter Military Academy, graduated 1897; then cotton business in Charleston until Jan 1898","Georgetown, South Carolina",-79.2916,33.3765,1898–1900,"Planted rice near Georgetown, South Carolina",South Carolina (various),-80,33,1900–1905,"Atlantic Coast Lumber Company, 1900–1905",,,,,,,,,,,,,,,,Yale (Student),-72.9279,41.3083,undefined,Student at Yale,"Washington, D.C.",-77.0369,38.9072,1908,Received appointment as forest assistant; reported to Washington D.C. July 1 1908,"Thompson Falls, Montana (Cabinet NF)",-115.3464,47.5985,1908,"Left same day for Thompson Falls, Montana; reconnaissance on Cabinet National Forest; timber estimates and land classification","Coeur d'Alene National Forest, Idaho",-116,47.3,1908–1909,"Forest assistant, Coeur d'Alene National Forest, from November 18 1908","Kootenai National Forest, Montana",-115.4,48.5,1909–1911,Transferred to Kootenai National Forest July 20 1909; deputy forest supervisor a few months later,"Missoula National Forest, Montana",-113.994,46.8721,1911–1913,"Transferred to Missoula National Forest as acting forest supervisor March 1911; forest supervisor from July 1 1912; HQ Missoula, Montana",,,,,,,,,,,,,,,,,,,,,1908
Burgess Dickinson,N,"Knoxboro, New York","Buffalo, New York",-78.8784,42.8864,c.1893–1907,"Grew up in McGrawville, Seneca Falls, and Buffalo NY; Master Park High School Buffalo; Ph.B. Yale 1907; attended Yale Forest School 1906–07 and 1907–08",,,,,,,,,,,,,,,,,,,,,,,,,,Yale (Student),-72.9279,41.3083,undefined,Student at Yale,"New York City, New York",-74.006,40.7128,c.1908–1913,Engineer for Edison Company in New York City; recently decided to devote to music; died suddenly January 28 1913 in New York City,,,,,,,,,,,,,,,,,,,,,,,,,,,,,,,,,,,,,,,,,1908
George E. Gage,N,"Springfield, Massachusetts","Springfield, Massachusetts",-72.5898,42.1015,1883–c.1901,Springfield High School,"Worcester, Massachusetts",-71.8023,42.2626,c.1901–c.1906,"Clark University, collegiate department","New Haven, Connecticut",-72.9279,41.3083,1906–1909,"Yale Forest School summer work 1906 and some Forest School work; M.A. Yale 1907; Ph.D. Yale 1909, specialty bacteriology and physiological chemistry",,,,,,,,,,,,,,,,Yale (Student),-72.9279,41.3083,undefined,Student at Yale,"Amherst, Massachusetts",-72.5199,42.3732,1911–1913,"Assistant professor of animal pathology, Massachusetts Agricultural College, Amherst, from September 1 1911",,,,,,,,,,,,,,,,,,,,,,,,,,,,,,,,,,,,,,,,,1908
Walter W. Gleason,N,"Ridgway, Pennsylvania","Johnsonburg, Pennsylvania",-78.6695,41.494,1886–c.1902,Johnsonburg High School,"Meadville, Pennsylvania",-80.1512,41.6417,c.1902–1906,"Allegheny College, B.S. 1906; member Phi Kappa Psi",,,,,,,,,,,,,,,,,,,,,Yale (Student),-72.9279,41.3083,undefined,Student at Yale,"New York City, New York",-74.006,40.7128,c.1906–c.1908,Appraiser for United States Leather Company,"New York City, New York",-74.006,40.7128,c.1908–c.1909,Forester for New York and Pennsylvania Pulp & Paper Company,"Potsdam, New York",-74.9821,44.6698,c.1909–1911,"Forester and woods superintendent, A. Sherman Lumber Company and Racquette River Paper Company; then assistant director of Wyman's School of the Woods","Munising, Michigan",-86.6498,46.4113,1911–1913,"Professor of logging and engineering at Wyman's School of the Woods from June 15 1911; city engineer of Munising; deputy county surveyor of Alger County; partner in Wyman, Gleason & Company",,,,,,,,,,,,,,,,,,,,,,,,,,1908
James E. Martin,N,"Brockton, Massachusetts","Brockton, Massachusetts",-71.0184,42.0834,1883–1906,"Brockton High School; Massachusetts Agricultural College, B.S. 1906; member C.S.C.","Plainfield, New Jersey",-74.4079,40.6337,1907,"City forester of Plainfield, NJ, summer 1907","Cambridge, Massachusetts",-71.1056,42.3736,1907–1908,"Harvard University, M.F. degree 1908, after leaving Yale Forest School in 1907",,,,,,,,,,,,,,,,Yale (Student),-72.9279,41.3083,undefined,Student at Yale,"Leadville, Colorado (Leadville NF)",-106.2925,39.2503,1908–1913,"Forest assistant, US Forest Service, HQ Leadville National Forest, Colorado, from July 1 1908",,,,,,,,,,,,,,,,,,,,,,,,,,,,,,,,,,,,,,,,,1908
Wilfred E. Murchie,N,"South Orange, New Jersey","South Orange, New Jersey",-74.2604,40.7512,1885–c.1903,South Orange High School,"Andover, Massachusetts",-71.137,42.6584,c.1903–1907,"Phillips Andover; Sheffield Scientific School Yale, graduated 1907; member Phi Beta Kappa",,,,,,,,,,,,,,,,,,,,,Yale (Student),-72.9279,41.3083,undefined,Student at Yale,"Newark, New Jersey",-74.1724,40.7357,c.1908–c.1910,"Bailey & Alling Lumber Company, Newark, New Jersey","Brooklyn, New York",-73.9442,40.6782,c.1910–1912,"Cross, Austin & Ireland Lumber Company, Brooklyn, New York","New York City, New York",-74.006,40.7128,1912–1913,"Secretary and treasurer, Shillito & Murchie Inc., from February 1 1912",,,,,,,,,,,,,,,,,,,,,,,,,,,,,,,1908
Royal F. Nash,N,"Grand Rapids, Wisconsin","Grand Rapids, Wisconsin",-89.9801,44.5236,1885–c.1901,Grand Rapids High School,"Berkeley, California",-122.2727,37.8716,c.1901–c.1904,University of California,"Madison, Wisconsin",-89.4012,43.0731,c.1904–c.1906,University of Wisconsin,,,,,,,,,,,,,,,,Yale (Student),-72.9279,41.3083,undefined,Student at Yale,Philippine Islands,121.774,12.8797,c.1908–1913,"Forester, Philippine Bureau of Forestry",,,,,,,,,,,,,,,,,,,,,,,,,,,,,,,,,,,,,,,,,1908
Herbert S. Nelson,N,"New Haven, Connecticut","New Haven, Connecticut",-72.9279,41.3083,1885–1905,"Hillhouse High School; Sheffield Scientific School Yale, graduated 1905","Windsor Locks, Connecticut",-72.6387,41.9298,1905–1906,"Hartford & Springfield Street Railway Company as rodman and draftsman, Aug 1905–Jan 1906","Paterson, New Jersey",-74.1718,40.9168,1906,"Lackawanna Railroad, Bergen Hill Tunnel construction under Jersey City, Feb–Oct 1906",,,,,,,,,,,,,,,,Yale (Student),-72.9279,41.3083,undefined,Student at Yale,"New Haven, Connecticut",-72.9279,41.3083,1906–1908,Yale Forest School 1906–07; camp at Milford PA; then in New Haven Sept 1907–Oct 1908,"Searchlight, Nevada",-114.9219,35.4706,1908–1910,"Quartette Mine at Searchlight, Nevada; mine and cyanide mill work for two years",Nevada (railroad construction),-117,38,1910,"Construction of new layout on San Pedro, Los Angeles & Salt Lake Railroad","New London, Connecticut",-72.1007,41.3557,1911–1913,"Civil engineer, New York New Haven & Hartford Railroad, from October 1911",,,,,,,,,,,,,,,,,,,,,,,,,,1908
Aretas A. Saunders,N,"Avon, Connecticut","New Haven, Connecticut",-72.9279,41.3083,c.1898–1907,"Boardman Manual Training School; Sheffield Scientific School Yale, graduated 1907; swimming teams; last term's work March 1908 in Alabama pine woods",,,,,,,,,,,,,,,,,,,,,,,,,,Yale (Student),-72.9279,41.3083,undefined,Student at Yale,"Bozeman, Montana (Gallatin NF)",-111.0429,45.677,1908–1909,"Forest assistant, Gallatin National Forest, July 1908–August 1909","Anaconda, Montana (Deerlodge NF)",-112.943,46.128,1909,"Deerlodge National Forest, Anaconda, Montana, August–October 1909","Camp Crook, South Dakota (Sioux NF)",-103.9776,45.5494,1909–1910,"Sioux National Forest, Camp Crook, South Dakota, October 1909–January 1910","Anaconda, Montana (Deerlodge NF)",-112.943,46.128,1910–1911,"Deerlodge National Forest, January 1910–June 1911","Chouteau, Montana (Lewis and Clark NF)",-110.4471,47.843,1911–1913,"Forest assistant, Lewis and Clark National Forest, HQ Chouteau, Montana, from June 1911",,,,,,,,,,,,,,,,,,,,,1908
