Name,Graduated (Y/N),Birthplace,Pre-Yale location 1,Pre-Yale Location 1 X Coordinate,Pre-Yale Location 1 Y Coordinate,Year(s) at pre-Yale location 1,Description of pre-Yale location 1,Pre-Yale location 2,Pre-Yale Location 2 X Coordinate,Pre-Yale Location 2 Y Coordinate,Year(s) at pre-Yale location 2,Description of pre-Yale location 2,Pre-Yale location 3,Pre-Yale Location 3 X Coordinate,Pre-Yale Location 3 Y Coordinate,Year(s) at pre-Yale location 3,Description of pre-Yale location 3,Pre-Yale location 4,Pre-Yale Location 4 X Coordinate,Pre-Yale Location 4 Y Coordinate,Year(s) at pre-Yale location 4,Description of pre-Yale location 4,Pre-Yale location 5,Pre-Yale Location 5 X Coordinate,Pre-Yale Location 5 Y Coordinate,Year(s) at pre-Yale location 5,Description of pre-Yale location 5,Pre-Yale location 6,Pre-Yale Location 6 X Coordinate,Pre-Yale Location 6 Y Coordinate,Year(s) at pre-Yale location 6,Description of pre-Yale location 6,Yale Location,Yale X,Yale Y,Year(s) at Yale,Yale Description,Work Location 1,Work Location 1 X Coordinate,Work Location 1 Y Coordinate,Year(s) at Location 1,Description of work Location 1,Work Location 2,Work Location 2 X Coordinate,Work Location 2 Y Coordinate,Year(s) at Location 2,Description of work Location 2,Work Location 3,Work Location 3 X Coordinate,Work Location 3 Y Coordinate,Year(s) at Location 3,Description of work Location 3,Work Location 4,Work Location 4 X Coordinate,Work Location 4 Y Coordinate,Year(s) at Location 4,Description of work Location 4,Work Location 5,Work Location 5 X Coordinate,Work Location 5 Y Coordinate,Year(s) at Location 5,Description of work Location 5,Work Location 6,Work Location 6 X Coordinate,Work Location 6 Y Coordinate,Year(s) at Location 6,Description of work Location 6,Work Location 7,Work Location 7 X Coordinate,Work Location 7 Y Coordinate,Year(s) at Location 7,Description of work Location 7,Work Location 8,Work Location 8 X Coordinate,Work Location 8 Y Coordinate,Year(s) at Location 8,Description of work Location 8,Work Location 9,Work Location 9 X Coordinate,Work Location 9 Y Coordinate,Year(s) at Location 9,Description of work Location 9,Class
Alfred Akerman,Y,"Cartersville, GA","Cartersville, GA",-84.7997,34.1651,,Prepared at Cartersville High School,"Athens, GA",-83.3576,33.9519,1898,"Received B.A. from Franklin College, University of Georgia","Berlin & Tübingen, Germany",13.405,52.52,,Studied at Berlin and Tübingen before entering Yale Forest School,,,,,,,,,,,,,,,,Yale (Student),-72.9279,41.3083,undefined,Student at Yale,"New Haven, CT",-72.9279,41.3082,,Instructor at the Yale Forest School,"Washington, DC",-77.0369,38.9072,,Forest assistant in the United States Forest Service,"Hartford, CT",-72.6851,41.7637,,State forester of Connecticut,"Boston, MA",-71.0589,42.3601,,State forester of Massachusetts,"Athens, GA",-83.3576,33.9519,1906–present,"Professor of forestry at the University of Georgia (since July 1, 1906)",,,,,,,,,,,,,,,,,,,,,1902
Charles S. Chapman,Y,"Westbrook, CT","Westbrook, CT",-72.4468,41.3015,,"Prepared in the public schools of Westbrook, CT","Storrs, CT",-72.2504,41.8084,1898,Graduated with degree of B.Agr. from Storrs (now Connecticut) Agricultural College,,,,,,,,,,,,,,,,,,,,,Yale (Student),-72.9279,41.3083,undefined,Student at Yale,"Washington, DC",-77.0369,38.9072,1902–1905,Forest assistant in the United States Forest Service,"Charleston, SC",-79.9311,32.7765,1905–1907,Forester for the E. P. Burton Lumber Company,"Washington, DC",-77.0369,38.9072,1907–1908,Inspector of timber sales in the Forest Service,"Washington, DC",-77.0369,38.9072,1908–1909,"Chief of the office of organization and assistant forester, operation, in the Forest Service","Washington, DC",-77.0369,38.9072,1909–1910,"Forester, District 6 (Washington, Oregon and Alaska), Forest Service","Portland, OR",-122.675,45.5231,present,Secretary and manager of the Oregon Forest Fire Association,,,,,,,,,,,,,,,,1902
Alfred K. Chittenden,Y,"New Haven, CT","New Haven, CT",-72.9279,41.3082,,Prepared at Hopkins Grammar School of New Haven,"New Haven, CT",-72.9279,41.3082,1900,Graduated from the Sheffield Scientific School (Civil Engineer Course); member of Sigma Xi,,,,,,,,,,,,,,,,,,,,,Yale (Student),-72.9279,41.3083,undefined,Student at Yale,"Europe (Germany, Austria, Switzerland, France, England)",10.4515,51.1657,1902–1903,"Went abroad for seven months to study forest conditions in Germany, Austria, Switzerland, France and England after graduation from Forest School","Washington, DC",-77.0369,38.9072,1902–1907,"United States Forest Service — served successively as forest assistant, chief of section of cooperation, assistant district forester, and forest inspector","Baltimore, MD",-76.6122,39.2904,1907,Private consulting forestry under the firm name Chittenden & Patterson,"Washington, DC",-77.0369,38.9072,1911–present,"Forester in the United States Indian Service (appointed September 20, 1911)","Urbana, IL",-88.2073,40.1106,present,"Director of the engineering experiment station and lecturer on timber and timber resources, College of Engineering, University of Illinois",,,,,,,,,,,,,,,,,,,,,1902
George E. Clement,Y,"Vienna, Austria","Cambridge, MA",-71.1167,42.377,1900,Received B.A. from Harvard University,,,,,,,,,,,,,,,,,,,,,,,,,,Yale (Student),-72.9279,41.3083,undefined,Student at Yale,New England,-71.5301,43.9654,present,"Engaged in study of the gypsy moth situation in New England, in cooperation between the Forest Service and the Bureau of Entomology",New England,-71.5301,43.9654,,Employed as forester for the Great Northern Paper Company,"Boston, MA",-71.0589,42.3601,,"Employed as forester for Fisher & Bryant, consulting foresters",,,,,,,,,,,,,,,,,,,,,,,,,,,,,,,1902
C. Temple Emmet,Y,"Pelham, NY","Lennoxville, Quebec, Canada",-71.8517,45.3778,,"Prepared at Bishops College School, Lennoxville, Quebec","Hoboken, NJ",-74.0243,40.744,,Attended Stevens High School,"Hoboken, NJ",-74.0243,40.744,1891,Graduated with degree of M.E. from Stevens Institute of Technology,,,,,,,,,,,,,,,,Yale (Student),-72.9279,41.3083,undefined,Student at Yale,"Stony Brook, NY",-73.1454,40.9315,present,"Engaged in farming at Stony Brook, Long Island",,,,,,,,,,,,,,,,,,,,,,,,,,,,,,,,,,,,,,,,,1902
"William C. Hodge, Jr.",Y,"Buffalo, NY","Buffalo, NY",-78.8784,42.8864,,Prepared at Buffalo High School,"Andover, MA",-71.137,42.652,,Prepared at Phillips Andover Academy,"New Haven, CT",-72.9279,41.3082,1899,Received degree of B.A. at Yale; member of Psi Upsilon,,,,,,,,,,,,,,,,Yale (Student),-72.9279,41.3083,undefined,Student at Yale,"Washington, DC",-77.0369,38.9072,1902–1908,Entered the United States Forest Service after graduation from Forest School,"Sacramento, CA",-121.4944,38.5816,1908–1910,Deputy state forester of California,"San Francisco, CA",-122.4194,37.7749,1910–present,"Re-entered Government Service; inspector of fire plans under operation in District 5 (office of silviculture), Forest Service headquarters",,,,,,,,,,,,,,,,,,,,,,,,,,,,,,,1902
Ralph S. Hosmer,Y,"Deerfield, MA","Boston, MA",-71.0589,42.3601,,Studied at Boston Latin School for two years and with private tutors,"Cambridge, MA",-71.1167,42.377,1891–1895,"Attended Bussey Institution and Lawrence Scientific School, Harvard University; received B.A.S. (1894)",,,,,,,,,,,,,,,,,,,,,Yale (Student),-72.9279,41.3083,undefined,Student at Yale,"Washington, DC",-77.0369,38.9072,1896–1898,"Assistant in the division of soils, United States Department of Agriculture (May 1896 – November 1898)","Moosehead Lake, ME",-69.6306,45.6267,1902,"In charge of a party studying spruce on cut-over land near Moosehead Lake, jointly by Bureau of Forestry and State of Maine (summer 1902)","Washington, DC",-77.0369,38.9072,1903,"Chief of the section of forest replacement, Bureau of Forestry; inspection trip to New England regarding white pine work","Los Angeles, CA",-118.2437,34.0522,1903,In charge of cooperative forest investigation by Bureau of Forestry and State of California in Southern California (July–November 1903),"Honolulu, HI",-157.8583,21.3069,1903–present,Collaborator of Bureau of Forestry and Forest Service; superintendent of forestry in Hawaii under Board of Commissioners of Agriculture and Forestry (since December 1903),,,,,,,,,,,,,,,,,,,,,1902
Roy L. Marston,Y,"Skowhegan, ME","Skowhegan, ME",-69.7131,44.7709,,Prepared at Bloomfield Academy and Skowhegan High School,"Brunswick, ME",-69.9653,43.9048,1899,Received degree of B.A. from Bowdoin College,"Skowhegan, ME",-69.7131,44.7709,,Was in the lumber business for five years before entering Yale Forest School,,,,,,,,,,,,,,,,Yale (Student),-72.9279,41.3083,undefined,Student at Yale,"New Haven, CT",-72.9279,41.3082,1902–1906,Taught at the Yale Forest School (until April 1906),"West Point, NY",-73.9574,41.3904,1906–1910,Forester then academic staff member at the United States Military Academy,"Various (NY, NH, VT, FL, PA, WV, OR, WA, CA, TX, LA, MS, ME, Canada, Mexico, Korea, China)",-95.7129,37.0902,1905–1910,Private consulting forester — worked professionally in multiple US states and internationally,"Washington, DC",-77.0369,38.9072,1910–1912,Member of the Tariff Board; in charge of investigation of pulp industry and survey of available pulp material,"Skowhegan, ME",-69.7131,44.7709,1910–present,"Treasurer and manager of Coburn Heirs, Inc. (since December 26, 1910); prepared topographical map and working plan for 225,000-acre Coburn estate",,,,,,,,,,,,,,,,,,,,,1902
George H. Myers,Y,"Cleveland, OH","Pottstown, PA",-75.6496,40.2454,,"Prepared at the Hill School, Pottstown, PA","New Haven, CT",-72.9279,41.3082,1898,Graduated from Yale College; received second colloquy Senior appointment,"Cambridge, MA",-71.1167,42.377,1898–1899,Studied botany and English at the Harvard Graduate School,,,,,,,,,,,,,,,,Yale (Student),-72.9279,41.3083,undefined,Student at Yale,"Washington, DC",-77.0369,38.9072,1902–1905,Engaged in the United States Forest Service for three years after graduation from Forest School; extensive travel for study of forests,"New York, NY",-74.006,40.7128,present,Shifted attention to business; land purchasing in Connecticut and interest in lumbering in the State of Washington; member of Graduate Advisory Board of Yale Forest School,,,,,,,,,,,,,,,,,,,,,,,,,,,,,,,,,,,,1902
John B. Anderson,Y,"Martin, MI","Schenectady, NY",-73.9396,42.8142,1896,Received degree of Ph.B. at Union College,,,,,,,,,,,,,,,,,,,,,,,,,,Yale (Student),-72.9279,41.3083,undefined,Student at Yale,"Black Mountain, NC",-82.3243,35.6154,recent years,"Manager of a sawmill and cannery at Black Mountain, NC",,,,,,,,,,,,,,,,,,,,,,,,,,,,,,,,,,,,,,,,,1903
Edward A. Braniff,Y,"Houtzdale, PA","Kansas City, MO",-94.5786,39.0997,,"Prepared at Central High School, Kansas City, MO; newspaper writer for the Kansas City Star before entering Yale",,,,,,,,,,,,,,,,,,,,,,,,,,Yale (Student),-72.9279,41.3083,undefined,Student at Yale,"Kansas City, MO",-94.5786,39.0997,,Previously manager of bond department of Merrell & Braniff (surety bond and liability insurance company),"Kansas City, MO / Oklahoma City, OK",-94.5786,39.0997,present,"Manager of department for Western Missouri, Oklahoma and Kansas for Fidelity & Deposit Company of Maryland (casualty insurance and surety bonds)",,,,,,,,,,,,,,,,,,,,,,,,,,,,,,,,,,,,1903
George L. Clothier,Y,"Walkersville, WV","Manhattan, KS",-96.5717,39.1836,1892,Kansas State Agricultural College — received degree of B.S.; also taught in country schools and worked on father's farm before entering college,"Manhattan, KS",-96.5717,39.1836,1895–1899,Postgraduate student and assistant in botany at Kansas State Agricultural College; received degree of M.S.,,,,,,,,,,,,,,,,,,,,,Yale (Student),-72.9279,41.3083,undefined,Student at Yale,"Washington, DC",-77.0369,38.9072,1900–1905,Employed in the United States Forest Service (July 1900 to August 1905),"Starkville, MS",-88.8183,33.4504,1905–1911,"Mississippi Agricultural and Mechanical College — assistant in horticultural department, later professor of botany and forestry","Pullman, WA",-117.1817,46.7298,1911–present,"Appointed professor of forestry at the State College of Washington (September 1911); also owns 1,053-acre stock farm in Paxico, KS",,,,,,,,,,,,,,,,,,,,,,,,,,,,,,,1903
Albert W. Cooper,Y,"Denver, CO","Boston, MA",-71.0589,42.3601,,Prepared at Roxbury Latin School,"Cambridge, MA",-71.1167,42.377,1901,Received degree of B.A. at Harvard; member of Theta Delta Chi,,,,,,,,,,,,,,,,,,,,,Yale (Student),-72.9279,41.3083,undefined,Student at Yale,Minnesota / Texas,-94.6859,46.7296,1903–,USFS — working plans in Minnesota and Texas,California,-119.4179,36.7783,,USFS — commercial plans in California,"Albany, NY region",-73.7562,42.6526,,Superintendent of woodlands for the Delaware & Hudson Railroad Company,"Washington, DC",-77.0369,38.9072,,"USFS — chief of silviculture, District I","Spokane, WA",-117.426,47.6588,1910–present,"Secretary of the Western Pine Manufacturers Association (since January 1, 1910)",,,,,,,,,,,,,,,,,,,,,1903
Richard T. Fisher,Y,"Brooklyn, NY","Chicago, IL",-87.6298,41.8781,,"Prepared at Harvard School, Chicago, IL","Cambridge, MA",-71.1167,42.377,1898,Received degree of B.A. at Harvard,,,,,,,,,,,,,,,,,,,,,Yale (Student),-72.9279,41.3083,undefined,Student at Yale,"Washington, DC / field",-77.0369,38.9072,1898–1903,"Field agent of US Biological Survey (summer 1898); assistant in English at Harvard College (1898–99); USFS student assistant, agent, and field assistant (1899–1903)","Cambridge, MA",-71.1167,42.377,1903–1906,Instructor in forestry at Harvard University (upon Forest School graduation until 1906),"Cambridge, MA",-71.1167,42.377,1906–present,Assistant professor of forestry at Harvard University (appointed 1906),"Boston, MA",-71.0589,42.3601,1907–present,"Member of firm Fisher, Cory & Bryant (now Fisher, Olmsted & Bryant), consulting foresters",,,,,,,,,,,,,,,,,,,,,,,,,,1903
Wesley J. Gardner,Y,"Plainfield, NJ","Helena, MT",-112.027,46.5958,,"Prepared at Helena High School, Helena, MT","Cambridge, MA",-71.1167,42.377,1900,Received degree of B.A. cum laude at Harvard; honorable mention in philosophy,,,,,,,,,,,,,,,,,,,,,Yale (Student),-72.9279,41.3083,undefined,Student at Yale,California / Idaho / Montana / Colorado / Oklahoma,-119.4179,36.7783,1903–1906,"USFS forest assistant — work directed chiefly along reforestation in national forest reserves in CA, ID, MT, CO, and OK","Washington, DC",-77.0369,38.9072,1906,"Died June 15, 1906 at Episcopal Eye, Ear and Throat Hospital in Washington, DC; buried in Washington, DC",,,,,,,,,,,,,,,,,,,,,,,,,,,,,,,,,,,,1903
Austin F. Hawes,Y,"Danvers, MA","Somerville, MA",-71.0995,42.3876,,Prepared at Somerville Latin School,"Medford, MA",-71.1194,42.406,1901,Received degree of B.A. at Tufts College,,,,,,,,,,,,,,,,,,,,,Yale (Student),-72.9279,41.3083,undefined,Student at Yale,Various,-77.0369,38.9072,1900–1902,"Employed in the United States Forest Service during summers of 1900, 1901, and 1902","Washington, DC / field",-77.0369,38.9072,1903–1904,USFS forest assistant (1903–04),"Hartford, CT",-72.6851,41.7637,1904–1909,State forester of Connecticut,"Burlington, VT",-73.2121,44.4759,1909–present,"State forester of Vermont and professor of forestry at the University of Vermont (appointed April 1, 1909)",,,,,,,,,,,,,,,,,,,,,,,,,,1903
Wallace I. Hutchinson,Y,"Wolfville, Nova Scotia, Canada","Wolfville, NS, Canada",-64.3639,45.0914,,"Prepared at Horton Collegiate Academy, Wolfville","Wolfville, NS, Canada",-64.3639,45.0914,1901,"Received degree of B.A. from Acadia University, Wolfville, Nova Scotia","Washington, DC / field",-77.0369,38.9072,1901–1903,"Entered United States Forest Service July 1, 1901 (before Yale graduation)",,,,,,,,,,,,,,,,Yale (Student),-72.9279,41.3083,undefined,Student at Yale,California / Nebraska / NC / NJ / PA,-119.4179,36.7783,1903–1905,"USFS forest agent (1903–1905) serving in California, Nebraska, North Carolina, New Jersey, and Pennsylvania","Washington, DC",-77.0369,38.9072,1905,USFS forest assistant,"Mindanao / Jolo Archipelago, Philippines",125,8,1905–1909,Forester in the Philippine Bureau of Forestry — in charge of southern administrative district embracing Mindanao and Jolo Archipelago,"Asia / Europe (Malay States, Burma, India, Ceylon, France, Austria-Hungary, Germany)",101.6869,3.139,1909,"Studied forest management and extension in Federated Malay States, Burma, India, Ceylon, France, Austria-Hungary, and Germany","Pike National Forest, CO",-105.08,39.05,1909–present,"USFS forest assistant in the Pike National Forest, Colorado (appointed September 1909)",,,,,,,,,,,,,,,,,,,,,1903
Elers Koch,Y,"Bozeman, MT","Bozeman, MT",-111.0429,45.677,,Prepared at Bozeman High School,Washington State,-120.7401,47.7511,1899,Served as student assistant in the United States Forest Service in the state of Washington (summer 1899),"Bozeman, MT",-111.0429,45.677,1901,Received degree of B.S. from Montana State College of Agriculture and Mechanic Arts,,,,,,,,,,,,,,,,Yale (Student),-72.9279,41.3083,undefined,Student at Yale,California / Montana / Wyoming,-111.0429,45.677,1903–1904,"USFS forest assistant — boundary work in California, Montana, and Wyoming",Montana / Wyoming,-111.0429,46.8721,1905–1906,USFS forest inspector in Montana and Wyoming,"Missoula, MT",-113.994,46.8721,1907–present,"Supervisor of Lolo National Forest, Missoula, MT (since January 1, 1907)",,,,,,,,,,,,,,,,,,,,,,,,,,,,,,,1903
Francis G. Miller,Y,"Lanark, IL","Cedar Falls, IA",-92.4558,42.5236,1893,Iowa State Teachers College — received degree of Bachelor of Didactics; superintendent of city schools in Iowa 1893–1899,"Iowa City, IA",-91.5302,41.6611,1900,Received degree of Ph.B. from the University of Iowa,"Ames, IA",-93.6319,42.0308,1901,Iowa State College of Agriculture and Mechanic Arts — received degree of B.S.A.; entered USFS July 1901; member of Sigma Xi,,,,,,,,,,,,,,,,Yale (Student),-72.9279,41.3083,undefined,Student at Yale,"Lincoln, NE",-96.7026,40.8136,1903–1907,Professor of forestry at the University of Nebraska,"Seattle, WA",-122.3321,47.6062,1907–1912,"Dean of the School of Forestry, University of Washington","Wenatchee, WA",-120.3103,47.4235,1912–present,Manager of the Wenatchee Columbia Fruit Company (since June 1912),,,,,,,,,,,,,,,,,,,,,,,,,,,,,,,1903
Ellie J. S. Moore,Y,"Bozeman, MT","Bozeman, MT",-111.0429,45.677,1901,Received degree of B.S. from Montana State College,,,,,,,,,,,,,,,,,,,,,,,,,,Yale (Student),-72.9279,41.3083,undefined,Student at Yale,Various,-95.7129,37.0902,1903–1904,Employed by the United States Forest Service,"Bozeman, MT",-111.0429,45.677,1904–present,Principally engaged in ranching,,,,,,,,,,,,,,,,,,,,,,,,,,,,,,,,,,,,1903
J. Girvin Peters,Y,"Baltimore, MD","Baltimore, MD",-76.6122,39.2904,,"Prepared at Marston's University School, Baltimore; member of Delta Phi, leader of Glee, Banjo and Mandolin clubs at Johns Hopkins","Baltimore, MD",-76.6122,39.2904,1900,Graduated from Johns Hopkins University — received degree of B.A.,"The Dalles / Bridal Veil, OR",-121.1787,45.5946,1901–1902,Lumber business in Oregon — with Joseph T. Peters & Company at The Dalles and the Bridal Veil Lumbering Company at Bridal Veil; met Gifford Pinchot on a trip up Mt. Hood,,,,,,,,,,,,,,,,Yale (Student),-72.9279,41.3083,undefined,Student at Yale,"Washington, DC / various field sites",-77.0369,38.9072,1903–1908,"USFS forest assistant (1903): field work in NH, LA, TX, NC, NY, Black Hills SD, SW, CA, Idaho; appointed forest examiner (1908)","Washington, DC",-77.0369,38.9072,1909,USFS chief of state and private cooperation,"Washington, DC",-77.0369,38.9072,1911–present,USFS chief of state cooperation; member Graduate Advisory Board Yale Forest School (2005–1916 term),,,,,,,,,,,,,,,,,,,,,,,,,,,,,,,1903
Samuel N. Spring,Y,"Sioux City, IA","Le Mars, IA",-96.1667,42.7794,,"Prepared at local schools in Le Mars, Iowa","Hull, IA",-96.1327,43.188,,"Attended Hull Academy, Hull, Iowa","New Haven, CT",-72.9279,41.3082,1898,"Graduated from Yale College; received Junior oration and Senior dissertation appointments; member of Freshman Glee Club, Apollo Glee Club, Banjo and Mandolin clubs",,,,,,,,,,,,,,,,Yale (Student),-72.9279,41.3083,undefined,Student at Yale,"Chicago, IL",-87.6298,41.8781,1898–1901,"With J. V. Farwell & Company, wholesale drygoods dealers (before entering Yale Forest School)","Washington, DC / field",-77.0369,38.9072,1902–1903,"Bureau of Forestry, US Dept of Agriculture — student assistant (summer 1902) and field assistant (summer 1903)","Orono, ME",-68.6736,44.8861,1903–1905,"Professor of forestry at the University of Maine, Orono",Middle West / Louisiana / Pacific Coast,-94.5786,39.0997,1905–1909,"USFS — cooperative work with railroads and individual landowners in Middle West and Louisiana (1906–07); chief of Office of Extension (1907), visiting Pacific coast and Rocky Mountain states","Washington, DC",-77.0369,38.9072,1909,"Private practice of forestry (beginning February 1, 1909)","New Haven, CT",-72.9279,41.3082,1909,State forester of Connecticut and forester of the Connecticut Agricultural Experiment Station; gave lecture series at Yale Forest School,"Ithaca, NY",-76.5021,42.444,1912–present,"Professor of forestry in the New York State College of Agriculture, Cornell University (October 1, 1912)",,,,,,,,,,,1903
William D. Sterrett,Y,"Bedford, PA","Washington, DC",-77.0369,38.9072,,"Prepared at Columbian Academy, Washington, DC","Washington, DC",-77.0369,38.9072,1900,Received degree of B.A. from George Washington University,"Cambridge, MA",-71.1167,42.377,1901,Received degree of B.A. from Harvard; member of Theta Delta Chi,,,,,,,,,,,,,,,,Yale (Student),-72.9279,41.3083,undefined,Student at Yale,"Washington, DC / Europe",-77.0369,38.9072,1903–1908,"USFS forest assistant (June 1903–March 1908); studied forestry in Germany, Switzerland, Austria, and France (April–December 1904)","Chihuahua, Mexico",-106.0889,28.6353,1908,"Cruised 500,000-acre timber tract in Chihuahua for the Development Company of America, New York City (April–June 1908); then private consulting forester","Manila, Philippines",120.9842,14.5995,1908–1910,Forester to the Philippine Islands in the Bureau of Forestry (December 1908–January 1910); completed tour around the world,"Washington, DC",-77.0369,38.9072,1910–present,"USFS forest assistant with headquarters at Washington, DC (since April 1910)",,,,,,,,,,,,,,,,,,,,,,,,,,1903
Henry G. Stevens,Y,"Detroit, MI","Ojai, CA",-119.2429,34.448,,"Prepared at Thacher School, Nordhoff (now Ojai), California","New Haven, CT",-72.9279,41.3082,1902,Graduated from Sheffield Scientific School at Yale; treasurer of Sheff YMCA; member of Junior and Senior track teams and Senior cross country and debating teams,,,,,,,,,,,,,,,,,,,,,Yale (Student),-72.9279,41.3083,undefined,Student at Yale,Europe and India,13.405,52.52,1903–1905,Traveled for two years in Europe and India studying forestry,"Detroit, MI",-83.0458,42.3314,1905,"Entered employ of H. W. Noble & Company, bankers of Detroit (January 1905)","Detroit, MI",-83.0458,42.3314,1906,"Became secretary of Bumpus-Stevens Company (investment securities), October 1906","Detroit, MI",-83.0458,42.3314,present,"Real estate business with the Stevens Land Company, Ltd.",,,,,,,,,,,,,,,,,,,,,,,,,,1903
Harry D. Tiemann,Y,"Brooklyn, NY","New York, NY",-74.006,40.7128,,"Prepared at Froebel Normal Institute, New York City, and Pratt Institute High School; received degree of M.E. from Stevens Institute of Technology (1897)","Brooklyn, NY",-73.9442,40.6782,,Taught chemistry at Pratt Institute and mechanical engineering at the University of Pennsylvania before entering Yale,"Washington, DC / field",-77.0369,38.9072,1900,Entered the United States Forest Service (1900); employed in field work in management,,,,,,,,,,,,,,,,Yale (Student),-72.9279,41.3083,undefined,Student at Yale,"New Haven, CT",-72.9279,41.3082,1903–1909,In charge of the Yale Timber Testing Laboratory (1903 to fall 1909),"Washington, DC",-77.0369,38.9072,1909–1910,"USFS headquarters in Washington, DC (winter 1909–10)","Madison, WI",-89.4012,43.0731,1910–present,"Chief of section of timber physics at the Forest Products Laboratory, Madison, WI; also lecturing at University of Wisconsin (since spring 1910); experiments in drying eucalyptus in California (1911–12)",,,,,,,,,,,,,,,,,,,,,,,,,,,,,,,1903
"Theodore S. Woolsey, Jr.",Y,"New Haven, CT","Southboro, MA",-71.5248,42.3131,,"Prepared at St. Mark's School, Southboro, MA","Pomfret, CT",-71.9637,41.8809,,"Attended Pomfret School of Pomfret, CT and the Fay School","New Haven, CT",-72.9279,41.3082,1901,Graduated from Yale College; on editorial board of Yale Daily News; member of Alpha Delta Phi,,,,,,,,,,,,,,,,Yale (Student),-72.9279,41.3083,undefined,Student at Yale,"Washington, DC / field",-77.0369,38.9072,1901–1908,"USFS — positions successively of assistant forest expert, forest assistant, and forest inspector (appointed May 15, 1907)",Germany / France / India,2.3522,48.8566,1904–1905,"Studied government forestry in Germany, France, and India","Albuquerque, NM",-106.6504,35.0844,1908–present,"USFS assistant district forester, District 3, Albuquerque, NM (appointed October 1908); acting chief of silviculture (March–April 1911)",Austria / France,14.5501,47.5162,present,On leave of absence studying in Austria and France,,,,,,,,,,,,,,,,,,,,,,,,,,1903
